Case Number,INC_Date,Year,Month Name,Quarter,Week of Year,Week of Month,Day Name,Day of Year,Day,Start of Hour,INC_Time,Target_Incidents,Incident Type_1,Incident Type_2,Incident Type_3,All_Incident_Types,Block,Location,FullAddress,Grid,Zone,Narrative,Total Value Stolen,Total Value Recover,VEHICLE1,VEHICLE2,Registration 1,Make1,Model1,Reg State 1,Registration 2,Reg State 2,Make2,Model2,Reviewed By,CompleteCalc,Officer of Record,Squad,Det_Assigned,Case_Status,NIBRS Classification,OCA_Length,INC_Date_and_Time,Narrative - Copy,Text Before Delimiter,Incident Date,Incident Time,Incident Date_Between,Incident Time_Between,Report Date,Report Time
25-004097,1/15/2025,2025,January,01,03,03,Wednesday,015,15,12:00,12:57,Motor Vehicle Theft,Motor Vehicle Theft,,,Motor Vehicle Theft,"First St, 200 Block",244 First Street,"244 First Street, Hackensack, NJ, 07601",H3,8,"On 01/15/2025 I responded to 244 First Street on a reported motor vehicle theft. Upon arrival I met with the driver of the stolen vehicle, Jeffrey Mejiamorquecho. He reported he parked his motor vehicle in front of 244 First Street facing north at around 24:00 hours. He further reported his mother left his residence at 05:00 hours on the listed date and noticed the vehicle was gone. The driver also reported he received a notification from EZ Pass with a charge from the George Washington Bridge toll at 04:13 hours on the listed date. The driver then walked out with me to where his vehicle was parked and observed broken glass which he suspected to be from his rear passenger side window. The driver advised me the vehicle had 1 plate in the rear and was worth approximately $50,000.00 as the vehicle was fairly new. He further reported he attempted to track the vehicle as it contains tracking equipment but was unsuccessful as it was not connecting. He believes it was disconnected somehow after the vehicle was stolen.240 First Street has cameras in the general direction of where the vehicle was parked. It is unknown at this time if they captured the incident occur.Insurance Information: Company: Geico (369)Policy Number: 6183163036The driver was provided with a completed New Jersey Victim Notification Form.The driver wished to have the vehicle processed if located and a Hackensack Police Consent to Search from was completed.The vehicle was entered into NCIC as stolen by Communications.The vehicle was entered into ATTF as stolen.",,,"NJ-U38ULG HONDA, CIV",,U38ULG,HONDA,CIV,NJ,,,,,Swetits_M,Complete,P.O. Frank Lorenzo 371,B1,Det. Matthew DeBonis 325,Active/Administratively Closed,240 = Theft of Motor Vehicle,9,45672.53958,"On 01/15/2025 I responded to 244 First Street on a reported motor vehicle theft. Upon arrival I met with the driver of the stolen vehicle, Jeffrey Mejiamorquecho. He reported he parked his motor vehicle in front of 244 First Street facing north at around 24:00 hours. He further reported his mother left his residence at 05:00 hours on the listed date and noticed the vehicle was gone. The driver also reported he received a notification from EZ Pass with a charge from the George Washington Bridge toll at 04:13 hours on the listed date. The driver then walked out with me to where his vehicle was parked and observed broken glass which he suspected to be from his rear passenger side window. The driver advised me the vehicle had 1 plate in the rear and was worth approximately $50,000.00 as the vehicle was fairly new. He further reported he attempted to track the vehicle as it contains tracking equipment but was unsuccessful as it was not connecting. He believes it was disconnected somehow after the vehicle was stolen.240 First Street has cameras in the general direction of where the vehicle was parked. It is unknown at this time if they captured the incident occur.Insurance Information: Company: Geico (369)Policy Number: 6183163036The driver was provided with a completed New Jersey Victim Notification Form.The driver wished to have the vehicle processed if located and a Hackensack Police Consent to Search from was completed.The vehicle was entered into NCIC as stolen by Communications.The vehicle was entered into ATTF as stolen.",244,01/15/25,12:57,,,01/15/25,12:57
25-004478,1/16/2025,2025,January,01,03,03,Thursday,016,16,12:00,12:00,Burglary - Residence,Burglary - Residence,,,Burglary - Residence,"Second St, 0 Block",30 Second Street,"30 Second Street, Hackensack, NJ, 07601",G3,7,"On Thursday, January 16, 2025 at approximately 1934 hours, Sgt. Peralta and I responded to 30 Second Street, Apt. L1 on report of a residential burglary. Upon arrival, I met with the victim who reported that she left her apartment at approximately 1200 hours on this date, before returning several hours later, at approximately 1800 hours. The victim further reported that upon returning to her apartment, she observed the exterior door knob to be damaged (loose), as if someone attempted to break in. The victim stated that upon entering the apartment, the interior did not appear to be ransacked, nor did anything appear out of place at this time.      The scene was unable to processed due to the victim contaminating evidence while entering her apartment. The cost of repair for the damaged door knob was approximately $35.00. A Victim Notification was completed and the victim was provided with a copy upon our departure. There were no known suspects at the time this report was taken. Det./Sgt. Tripodi was notified.",,,,,,,,,,,,,Deleon_A,Complete,P.O. Aziah Miller 357,A3,Det. Matthew DeBonis 325,Active/Administratively Closed,220 = Burglary/Breaking & Entering,9,45673.5,"On Thursday, January 16, 2025 at approximately 1934 hours, Sgt. Peralta and I responded to 30 Second Street, Apt. L1 on report of a residential burglary. Upon arrival, I met with the victim who reported that she left her apartment at approximately 1200 hours on this date, before returning several hours later, at approximately 1800 hours. The victim further reported that upon returning to her apartment, she observed the exterior door knob to be damaged (loose), as if someone attempted to break in. The victim stated that upon entering the apartment, the interior did not appear to be ransacked, nor did anything appear out of place at this time.      The scene was unable to processed due to the victim contaminating evidence while entering her apartment. The cost of repair for the damaged door knob was approximately $35.00. A Victim Notification was completed and the victim was provided with a copy upon our departure. There were no known suspects at the time this report was taken. Det./Sgt. Tripodi was notified.",30,01/16/25,12:00,01/16/25,18:00,01/16/25,19:34
25-004629,1/16/2025,2025,January,01,03,03,Thursday,016,16,21:00,21:03,Robbery,Robbery,,,Robbery,"Main St, 600 Block",630 Main Street,"630 Main Street, Hackensack, NJ, 07601",I1,9,"Suspect 1: Hispanic male, approximately early 30' s in age, approximately 5'10"" in height, approximately 180 in weight, wearing a tan hooded sweater, brown ""NY"" Yankees logo hat, black sweatpants and white sneakers.Suspect 2: Hispanic female, approximately mid 20's in age, approximately 5'5"" in height, approximately 140 in weight, wearing a black jacket, grey hooded sweater, tan pants and cream colored shoes. Suspect Vehicle: 4 door Silver in color Hyundai Sonata (unknown registration).On 1/17/25 P.O. Papanikolaou and I responded to 630 Main Street, Target on a reported shoplifting. While   speaking with Target Loss Prevention they wanted to report an additional incident, which occurred in the past.Target Loss Prevention / victim, Cheikh Gaye, reported on 1/16/25 at approximately 21:03 hours suspect 1 and suspect 2 entered Target. It was further reported on 1/16/25 at approximately 21:16 hours suspect 1 and 2 passed all points of sale with unpaid merchandise in a shopping cart. The unpaid merchandise (furniture, grocery, health and beauty, home and kitchen products) totaled $452.71. Prior to exiting Target Loss Prevention / the victim confronted both suspects. Target Loss Prevention were able to recover all merchandise that both suspects attempted to steal. While recovering the stolen merchandise suspect 1 punched the victim in the head, specifically the top left side, with a closed fist one time. The victim reported having a complaint of pain hours after being assaulted. Both suspect later left the area in the suspect vehicle. A Sgt. was requested and Sgt. Competiello responded. Detectives were notified. The victim later responded to headquarters to provide a voluntary statement. The victim refused medical attention at this time.A receipt of the unpaid merchandise was provided by Target Loss Prevention. The receipt was later secured in the Detective Bureau Mailbox.",,,"HYUNDAI, SONATA",,,HYUNDAI,SONATA,,,,,,Deleon_A,Complete,P.O. Massimo Gallorini 379,A2,Det. John Mora 257,Active Investigation,120 = Robbery,9,45673.87708,"Suspect 1: Hispanic male, approximately early 30' s in age, approximately 5'10"" in height, approximately 180 in weight, wearing a tan hooded sweater, brown ""NY"" Yankees logo hat, black sweatpants and white sneakers.Suspect 2: Hispanic female, approximately mid 20's in age, approximately 5'5"" in height, approximately 140 in weight, wearing a black jacket, grey hooded sweater, tan pants and cream colored shoes. Suspect Vehicle: 4 door Silver in color Hyundai Sonata (unknown registration).On 1/17/25 P.O. Papanikolaou and I responded to 630 Main Street, Target on a reported shoplifting. While   speaking with Target Loss Prevention they wanted to report an additional incident, which occurred in the past.Target Loss Prevention / victim, Cheikh Gaye, reported on 1/16/25 at approximately 21:03 hours suspect 1 and suspect 2 entered Target. It was further reported on 1/16/25 at approximately 21:16 hours suspect 1 and 2 passed all points of sale with unpaid merchandise in a shopping cart. The unpaid merchandise (furniture, grocery, health and beauty, home and kitchen products) totaled $452.71. Prior to exiting Target Loss Prevention / the victim confronted both suspects. Target Loss Prevention were able to recover all merchandise that both suspects attempted to steal. While recovering the stolen merchandise suspect 1 punched the victim in the head, specifically the top left side, with a closed fist one time. The victim reported having a complaint of pain hours after being assaulted. Both suspect later left the area in the suspect vehicle. A Sgt. was requested and Sgt. Competiello responded. Detectives were notified. The victim later responded to headquarters to provide a voluntary statement. The victim refused medical attention at this time.A receipt of the unpaid merchandise was provided by Target Loss Prevention. The receipt was later secured in the Detective Bureau Mailbox.",630,01/16/25,21:03,01/16/25,21:16,01/17/25,12:16
25-005871,1/21/2025,2025,January,01,04,04,Tuesday,021,21,19:00,19:00,Motor Vehicle Theft,Motor Vehicle Theft,,,Motor Vehicle Theft,"Ross Ave, 0 Block",33 Ross Avenue,"33 Ross Avenue, Hackensack, NJ, 07601",I1,9,"On January 22, 2025, I responded to the listed location on a report on a stolen motor vehicle. Upon arrival, I met with the registered owner, Kamil Garcia. The registered owner stated on January 21, 2025 at approximately 1800 hours he parked his vehicle, a 2023 Honda Passport color red bearing NJ registration U22RSV in front of 33 Ross Ave facing West. The registered owner stated that he currently has possession of the two key fobs that belong to the vehicle. At approximately 0309 hours on January 22, 2025 he responded to his vehicle where he last parked it and the vehicle was no longer there.       The registered owner received a completed victim notification. The vehicle was entered as stolen into NCIC (NIC #  V956704006) along with a stolen motor vehicle form. The vehicle was also entered as stolen into the  ATTF website. The registered owner does not wish to have the vehicle processed at this time. Approximate value for the above vehicle is 46,000.00 USD.",,,"NJ-U22RSV HONDA, PAS",,U22RSV,HONDA,PAS,NJ,,,,,Tovbin_S,Complete,P.O. Roselys Salas 369,B4,Det. John Tanucilli 335,Active/Administratively Closed,240 = Theft of Motor Vehicle,9,45678.79167,"On January 22, 2025, I responded to the listed location on a report on a stolen motor vehicle. Upon arrival, I met with the registered owner, Kamil Garcia. The registered owner stated on January 21, 2025 at approximately 1800 hours he parked his vehicle, a 2023 Honda Passport color red bearing NJ registration U22RSV in front of 33 Ross Ave facing West. The registered owner stated that he currently has possession of the two key fobs that belong to the vehicle. At approximately 0309 hours on January 22, 2025 he responded to his vehicle where he last parked it and the vehicle was no longer there.       The registered owner received a completed victim notification. The vehicle was entered as stolen into NCIC (NIC #  V956704006) along with a stolen motor vehicle form. The vehicle was also entered as stolen into the  ATTF website. The registered owner does not wish to have the vehicle processed at this time. Approximate value for the above vehicle is 46,000.00 USD.",33,01/21/25,19:00,01/22/25,3:09,01/22/25,3:10
25-006083,1/22/2025,2025,January,01,04,04,Wednesday,022,22,8:00,8:00,Motor Vehicle Theft,Motor Vehicle Theft,,,Motor Vehicle Theft,"Hudson St, 400 Block",443 Hudson Street,"443 Hudson Street, Hackensack, NJ, 07601",E3,5,"On January 22, 2025, I responded to the listed location on a report of a stolen motor vehicle. Upon arrival, I met with the victim, Melisssa Williams, also registered owner. The victim stated the vehicle has been lodged at 443 Hudson Street with permission of the resident Jermal Clark. The victim stated upon speaking to Jermal Clark he stated ""the vehicle was towed off the property early morning and he got some money for it.""  Sgt. Tovbin and I spoke to Jermal Clark, who stated that he does not know which towing company towed the vehicle. I asked Jermal Clark if he towed the vehicle off the property and he was uncooperative in answering the question.       The vehicle, a 2006 Nissan Pathfinder color black bearing NJ registration Y62SRJ, was last seen on January 21, 2025 at approximately 1600 hours parked facing South on the listed property. The victim stated that she currently does not have possession of the key. The victim indicated the one key was last in possession of Jermal Clark.       The registered owner received a completed victim notification. The vehicle was entered as stolen into NCIC (NIC # V146697789 ) along with a stolen motor vehicle form. The vehicle was also entered as stolen into the  ATTF website. The registered owner does not wish to have the vehicle processed at this time. Approximate value for the above vehicle is 2,500.00 USD.",,,"NJ-Y62SRJ NISSAN, PTH",,Y62SRJ,NISSAN,PTH,NJ,,,,,Swetits_M,Complete,P.O. Roselys Salas 369,B4,Det. Demetrius Carroll 133,Active/Administratively Closed,240 = Theft of Motor Vehicle,9,45679.33333,"On January 22, 2025, I responded to the listed location on a report of a stolen motor vehicle. Upon arrival, I met with the victim, Melisssa Williams, also registered owner. The victim stated the vehicle has been lodged at 443 Hudson Street with permission of the resident Jermal Clark. The victim stated upon speaking to Jermal Clark he stated ""the vehicle was towed off the property early morning and he got some money for it.""  Sgt. Tovbin and I spoke to Jermal Clark, who stated that he does not know which towing company towed the vehicle. I asked Jermal Clark if he towed the vehicle off the property and he was uncooperative in answering the question.       The vehicle, a 2006 Nissan Pathfinder color black bearing NJ registration Y62SRJ, was last seen on January 21, 2025 at approximately 1600 hours parked facing South on the listed property. The victim stated that she currently does not have possession of the key. The victim indicated the one key was last in possession of Jermal Clark.       The registered owner received a completed victim notification. The vehicle was entered as stolen into NCIC (NIC # V146697789 ) along with a stolen motor vehicle form. The vehicle was also entered as stolen into the  ATTF website. The registered owner does not wish to have the vehicle processed at this time. Approximate value for the above vehicle is 2,500.00 USD.",443,01/22/25,8:00,01/22/25,19:13,01/22/25,19:14
25-006324,1/23/2025,2025,January,01,04,04,Thursday,023,23,15:00,15:00,Sexual Assault,Sexual Assault,Juvenile Investigation,,"Sexual Assault, Juvenile Investigation","Berdan Pl, 100 Block",176  Berdan Place,"176  Berdan Place, Hackensack, NJ, 07601",H3,8,"On Thursday, 01/23/2025 I was notified by D/Sgt. Dominguez of a possible sexual assault involving a juvenile. I was advised that 10 y/o S.S. disclosed to a school teacher that her mothers boyfriend has been touching her while her mother was sleeping. This reportedly has occurred on multiple occasions. No further information was available at this time. S.S. is a student at Nelly K. Parker school, who already notified DCP&P as per protocol.    I contacted DCP&P social worker Jennifer Diaz who was assigned to the initial investigation. Ms. Diaz advised me that she was currently enroute to Nelly K. Parker to meet with S.S., and school staff. She advised me that she already contacted BCPO/SVU. I advised her that I will meet her at the school. Upon arrival I met with Ms. Diaz, who advised me that S.S. was set to be picked up from school by another unknown adult possibly the suspect. Due to the circumstances it was determined that S.S. will be transported to BCPO (100 Eisenhower Drive, Paramus NJ) to undergo a forensic interview with SVU. Contact was made to S.S. mother, Ibys Sandoval, who was advised that a police investigation is underway and her presence is required. Ms. Sandoval expressed that she has transportation issues, therefore this agency arranged transport for her.  Det. Reyes responded to pick up Ms. Sandoval at her residence (176 Berdan Place, Hackensack NJ). Ms. Sandoval was transported to Nelly K. Parker to meet up with her daughter, and ultimately transported to BCPO for the interview.   Contact information was limited at the time of this report (See Det. Reyes Supplemental report for further details)",,,,,,,,,,,,,Bay_F,Complete,Det. Frankie Garrett 323,DET,Det. Evelyn Reyes 336,TOT DCP&P,,9,45680.625,"On Thursday, 01/23/2025 I was notified by D/Sgt. Dominguez of a possible sexual assault involving a juvenile. I was advised that 10 y/o S.S. disclosed to a school teacher that her mothers boyfriend has been touching her while her mother was sleeping. This reportedly has occurred on multiple occasions. No further information was available at this time. S.S. is a student at Nelly K. Parker school, who already notified DCP&P as per protocol.    I contacted DCP&P social worker Jennifer Diaz who was assigned to the initial investigation. Ms. Diaz advised me that she was currently enroute to Nelly K. Parker to meet with S.S., and school staff. She advised me that she already contacted BCPO/SVU. I advised her that I will meet her at the school. Upon arrival I met with Ms. Diaz, who advised me that S.S. was set to be picked up from school by another unknown adult possibly the suspect. Due to the circumstances it was determined that S.S. will be transported to BCPO (100 Eisenhower Drive, Paramus NJ) to undergo a forensic interview with SVU. Contact was made to S.S. mother, Ibys Sandoval, who was advised that a police investigation is underway and her presence is required. Ms. Sandoval expressed that she has transportation issues, therefore this agency arranged transport for her.  Det. Reyes responded to pick up Ms. Sandoval at her residence (176 Berdan Place, Hackensack NJ). Ms. Sandoval was transported to Nelly K. Parker to meet up with her daughter, and ultimately transported to BCPO for the interview.   Contact information was limited at the time of this report (See Det. Reyes Supplemental report for further details)",176,01/23/25,15:00,,,01/23/25,15:58
25-006864,1/25/2025,2025,January,01,04,04,Saturday,025,25,11:00,11:00,Burglary - Residence,Burglary - Residence,,,Burglary - Residence,"Kansas St, 0 Block",60 Kansas Street,"60 Kansas Street, Hackensack, NJ, 07601",E1,5,"On January 25, 2025, at approximately 13:55 hours, P.O. P. Lopez, P.O. G. Lara-Nunez, P.O. Mattalian, Sgt. Competiello, and I responded to 60 Kansas apartment 8F for a possible burglary in progress. Upon arrival, I met with the victim who reported she left her apartment at approximately 11:30 hours. The victim reported approximately 14:00 hours, she returned to the apartment to find the front door slightly ajar.     We did a check of the interior of the apartment which yielded negative results for any suspects inside. The victim reported she is 100% sure the door was locked because she checked multiple times before leaving. The victim reported she was missing about $2,000 in miscellaneous jewelry. She described the jewelry to be earrings and gold necklaces.The victim reported she had the same incident occur in 2023. See 23-091001 for more. The victim reported she observed a light skin Hispanic male driving a black Lexus leaving the apartment complex as she pulled in. The victim reported she recalls the same Lexus and same male in the area after the previous incident.Sgt. Competiello contacted detectives. Detective DeBonis arrived on scene.The victim requested for the apartment to be processed. Sgt. Competiello contacted Bergen County Sheriff's Office. Detective LaSala #1866 arrived on scene. See BCSO case #2025-0052 for more .I observed no signs of forced entry. The New Jersey victim notification form was filled out and a copy was provided to the victim for her records.The crime scene was secured at 14:15 hours.Crime Scene Log:14:31: Det. LaSala Enters14:38: Det. LaSala Exits14:48: Det. Lasala Enters14:49: Det. Debonis Enters15:01: Det. LaSala Exits.15:04: Det. LaSala Enters.Crime Scene Terminated: 15:08",,,,,,,,,,,,,Levis_R,Complete,P.O. Andres Lopez 375,A2,Det. Matthew DeBonis 325,Active Investigation,220 = Burglary/Breaking & Entering,9,45682.45833,"On January 25, 2025, at approximately 13:55 hours, P.O. P. Lopez, P.O. G. Lara-Nunez, P.O. Mattalian, Sgt. Competiello, and I responded to 60 Kansas apartment 8F for a possible burglary in progress. Upon arrival, I met with the victim who reported she left her apartment at approximately 11:30 hours. The victim reported approximately 14:00 hours, she returned to the apartment to find the front door slightly ajar.     We did a check of the interior of the apartment which yielded negative results for any suspects inside. The victim reported she is 100% sure the door was locked because she checked multiple times before leaving. The victim reported she was missing about $2,000 in miscellaneous jewelry. She described the jewelry to be earrings and gold necklaces.The victim reported she had the same incident occur in 2023. See 23-091001 for more. The victim reported she observed a light skin Hispanic male driving a black Lexus leaving the apartment complex as she pulled in. The victim reported she recalls the same Lexus and same male in the area after the previous incident.Sgt. Competiello contacted detectives. Detective DeBonis arrived on scene.The victim requested for the apartment to be processed. Sgt. Competiello contacted Bergen County Sheriff's Office. Detective LaSala #1866 arrived on scene. See BCSO case #2025-0052 for more .I observed no signs of forced entry. The New Jersey victim notification form was filled out and a copy was provided to the victim for her records.The crime scene was secured at 14:15 hours.Crime Scene Log:14:31: Det. LaSala Enters14:38: Det. LaSala Exits14:48: Det. Lasala Enters14:49: Det. Debonis Enters15:01: Det. LaSala Exits.15:04: Det. LaSala Enters.Crime Scene Terminated: 15:08",60,01/25/25,11:00,01/25/25,14:00,01/25/25,13:55
