Case Number,INC_Date,Year,Month Name,Quarter,Week of Year,Week of Month,Day Name,Day of Year,Day,Start of Hour,INC_Time,Target_Incidents,Incident Type_1,Incident Type_2,Incident Type_3,All_Incident_Types,Block,Location,FullAddress,Grid,Zone,Narrative,Total Value Stolen,Total Value Recover,VEHICLE1,VEHICLE2,Registration 1,Make1,Model1,Reg State 1,Registration 2,Reg State 2,Make2,Model2,Reviewed By,CompleteCalc,Officer of Record,Squad,Det_Assigned,Case_Status,NIBRS Classification,OCA_Length,INC_Date_and_Time,Narrative - Copy,Text Before Delimiter,Incident Date,Incident Time,Incident Date_Between,Incident Time_Between,Report Date,Report Time
25-000813,1/3/2025,2025,January,01,01,01,Friday,003,03,21:00,21:30,Motor Vehicle Theft,Motor Vehicle Theft,,,Motor Vehicle Theft,"Lookout Ave, 300 Block",309 Lookout Avenue,"309 Lookout Avenue, Hackensack, NJ, 07601",I2,9,"On Saturday, January 4th, 2025, I responded to the listed location on a report of a motor vehicle theft. Upon arrival, I met the registered owner, who reported that his vehicle was parked in the driveway at 21:30 hours on 01/03/2025. He further reported that he left his residence with his friends in his friend's vehicle and returned to his residence on the morning of 01/04/2025. He noticed his vehicle was taken from his driveway. The registered owner reported there was nothing valuable in the car and was uncertain if the spare keys were in the vehicle. Both New Jersey plates are affixed to the vehicle.      Communications advised me that the vehicle was located in Clarkstown, NY, and was involved in a motor vehicle hit-and-run accident. The registered owner was also advised of the vehicle's location. I observed no cameras in the area.      The victim did not want the vehicle processed or to sign complaints if the suspect(s) are identified.     A New Jersey Victim Notification form was completed and provided to the registered owner.     An ATTF entry was completed    A motor vehicle checklist was completed and submitted.",,,"NJ-W46ULY HONDA, ACC",,W46ULY,HONDA,ACC,NJ,,,,,Klosk_J,Complete,P.O. Nicholas Mazzaccaro 377,B4,Det. Robert Ghirardi 150,Active/Administratively Closed,240 = Theft of Motor Vehicle,9,45660.89583,"On Saturday, January 4th, 2025, I responded to the listed location on a report of a motor vehicle theft. Upon arrival, I met the registered owner, who reported that his vehicle was parked in the driveway at 21:30 hours on 01/03/2025. He further reported that he left his residence with his friends in his friend's vehicle and returned to his residence on the morning of 01/04/2025. He noticed his vehicle was taken from his driveway. The registered owner reported there was nothing valuable in the car and was uncertain if the spare keys were in the vehicle. Both New Jersey plates are affixed to the vehicle.      Communications advised me that the vehicle was located in Clarkstown, NY, and was involved in a motor vehicle hit-and-run accident. The registered owner was also advised of the vehicle's location. I observed no cameras in the area.      The victim did not want the vehicle processed or to sign complaints if the suspect(s) are identified.     A New Jersey Victim Notification form was completed and provided to the registered owner.     An ATTF entry was completed    A motor vehicle checklist was completed and submitted.",309,01/03/25,21:30,01/04/25,6:25,01/04/25,10:59
25-002564,1/7/2025,2025,January,01,02,02,Tuesday,007,07,14:00,14:00,Criminal Sexual Contact,Criminal Sexual Contact,Juvenile Investigation,,"Criminal Sexual Contact, Juvenile Investigation","First St, 100 Block",135 First Street,"135 First Street, Hackensack, NJ, 07601",G3,7,"On Friday January 10, 2025, I was assigned as the Hackensack High School SRO. I was advised that a student wanted to report a crime and was currently in the main office. Upon arriving to the main office I met the victim, A.R.       As I began to speak with the victim she immediately began to cry. She stated that she was inappropriately touched by the suspect who is also student. The suspect was identified as Manuel Martinez Perez. The victim stated that on Tuesday January 7, 2025  she was in her 9th period class ESL 2 in room 276. She shares this class with the suspect and his cousin Esmeralda Perez Martinez who is a potential witness.       The victim stated during class the suspect gave her a hug. As he was hugging her he dropped his hand down and grabbed her breast over her clothing. She immediately became angry and told him not to touch her. She then advised Esmeralda Perez Martinez that she was touched inappropriately by the suspect. The victim stated that she reported this incident to her her teacher Mrs. Magdalene Symmonds, but she did not understand her due to a language barrier.  The victim reported that this was not the first time she was inappropriately touched by the suspect. She reported that the prior week a similar incident occurred. I notified assistant Principal Celso King of this report.      I spoke to Esmeralda Perez Martinez who may have witness the incident. Perez Martinez stated that she sits in a group with the victim and the suspect. The day of the incident she did not observe the suspect touch the victim because she was busy doing her class work. The witness did confirm that the victim mentioned to her that she was inappropriately touched by the suspect.       The victim's mother, Raquel Lelio, was notified of the incident and responded to the school. She advised me that she was not sure if she wanted to sign criminal complaints against the suspect. She wants to speak with her daughter and husband before making a decision.       Det. E. Reyes was advised of the incident and will follow up with the complainant at a later time.",,,,,,,,,,,,,Dominguez_L,Complete,Det. Cristobal Lara-Nunez 341,STA,Det. Evelyn Reyes 336,Active/Administratively Closed,11D = Fondling,9,45664.58333,"On Friday January 10, 2025, I was assigned as the Hackensack High School SRO. I was advised that a student wanted to report a crime and was currently in the main office. Upon arriving to the main office I met the victim, A.R.       As I began to speak with the victim she immediately began to cry. She stated that she was inappropriately touched by the suspect who is also student. The suspect was identified as Manuel Martinez Perez. The victim stated that on Tuesday January 7, 2025  she was in her 9th period class ESL 2 in room 276. She shares this class with the suspect and his cousin Esmeralda Perez Martinez who is a potential witness.       The victim stated during class the suspect gave her a hug. As he was hugging her he dropped his hand down and grabbed her breast over her clothing. She immediately became angry and told him not to touch her. She then advised Esmeralda Perez Martinez that she was touched inappropriately by the suspect. The victim stated that she reported this incident to her her teacher Mrs. Magdalene Symmonds, but she did not understand her due to a language barrier.  The victim reported that this was not the first time she was inappropriately touched by the suspect. She reported that the prior week a similar incident occurred. I notified assistant Principal Celso King of this report.      I spoke to Esmeralda Perez Martinez who may have witness the incident. Perez Martinez stated that she sits in a group with the victim and the suspect. The day of the incident she did not observe the suspect touch the victim because she was busy doing her class work. The witness did confirm that the victim mentioned to her that she was inappropriately touched by the suspect.       The victim's mother, Raquel Lelio, was notified of the incident and responded to the school. She advised me that she was not sure if she wanted to sign criminal complaints against the suspect. She wants to speak with her daughter and husband before making a decision.       Det. E. Reyes was advised of the incident and will follow up with the complainant at a later time.",135,01/07/25,14:00,,,01/10/25,14:20
25-002635,1/6/2025,2025,January,01,02,02,Monday,006,06,15:00,15:30,Burglary - Auto,Burglary - Auto,,,Burglary - Auto,"Prospect Ave, 0 Block",90 Prospect Avenue,"90 Prospect Avenue, Hackensack, NJ, 07601",,7,"Suspect(s): Unknown.     I responded to the listed location, 90 Prospect Avenue, on a report of a burglary to auto. Upon arrival, I was met by the victim, Kelly Nurnberg-Darzi, who stated on the morning of 01/10/25 she responded to her grey 2006 Honda Pilot and observed all of her work equipment to be missing. The victim advised me she specialized in opening safes and stores several of her high-value tools in the rear of the listed vehicle. The victim stated the listed vehicle was parked in assigned space #20 and did not move it from the assigned space. The victim stated she last recalled observing her tools in the listed vehicle on 01/06/25 and had not returned to the vehicle since. The following items were taken from the listed vehicle:2 Boroscope - $5,000.00 USD8 Redundant Locks - $2,000.00 USD5 Drills - $5,000.00 USD1 large box of drill bits - $1,200.00 USD1 tool bag with several tools - $2,000.00 USD6 Electronic locks - $1,320.00 USD4 FAS locks - $480.00 Total Value - $17,000.00 USD     While on scene, I observed several cameras in the parking garage of 90 Prospect Avenue. I further observed the listed vehicle to have a broken rear passenger side window which gives direct access to the vehicles trunk. The victim stated the damage occurred on 01/04/25 while her son was parking the vehicle. The victim further stated she did not have any time to repair the broken window and remove the tools from the vehicle prior to them being taken.      The victim advised me she believes the suspect may be her husband Uri Darzi whom she is currently in a civil lawsuit with. Sgt. Peralta responded assist.A victim notification form was completed and a copy was given to the victim.",,,"NJ-XCSW43 HONDA, PIL",,XCSW43,HONDA,PIL,NJ,,,,,Deleon_A,Complete,P.O. Ruben Almonte 359,A3,Det. Matthew DeBonis 325,Active/Administratively Closed,23F = Theft From Motor Vehicle,9,45663.64583,"Suspect(s): Unknown.     I responded to the listed location, 90 Prospect Avenue, on a report of a burglary to auto. Upon arrival, I was met by the victim, Kelly Nurnberg-Darzi, who stated on the morning of 01/10/25 she responded to her grey 2006 Honda Pilot and observed all of her work equipment to be missing. The victim advised me she specialized in opening safes and stores several of her high-value tools in the rear of the listed vehicle. The victim stated the listed vehicle was parked in assigned space #20 and did not move it from the assigned space. The victim stated she last recalled observing her tools in the listed vehicle on 01/06/25 and had not returned to the vehicle since. The following items were taken from the listed vehicle:2 Boroscope - $5,000.00 USD8 Redundant Locks - $2,000.00 USD5 Drills - $5,000.00 USD1 large box of drill bits - $1,200.00 USD1 tool bag with several tools - $2,000.00 USD6 Electronic locks - $1,320.00 USD4 FAS locks - $480.00 Total Value - $17,000.00 USD     While on scene, I observed several cameras in the parking garage of 90 Prospect Avenue. I further observed the listed vehicle to have a broken rear passenger side window which gives direct access to the vehicles trunk. The victim stated the damage occurred on 01/04/25 while her son was parking the vehicle. The victim further stated she did not have any time to repair the broken window and remove the tools from the vehicle prior to them being taken.      The victim advised me she believes the suspect may be her husband Uri Darzi whom she is currently in a civil lawsuit with. Sgt. Peralta responded assist.A victim notification form was completed and a copy was given to the victim.",90,01/06/25,15:30,01/10/25,,01/10/25,19:49
25-003362,1/13/2025,2025,January,01,03,03,Monday,013,13,12:00,12:05,Robbery,Dispute,Criminal Attempt,Robbery,"Dispute, Criminal Attempt, Robbery","Clay St, 200 Block",204 Clay Street,"204 Clay Street, Hackensack, NJ, 07601",H3,8,"On Monday, January 13th, 2025, at approximately 12:07 hours, P.O. Alvarez and I responded to the listed location on a dispute report. Before our arrival, headquarters had advised us that the male suspect, described as wearing a grey hoodie and sweatpants, had fled southbound on First Street. Upon arrival, we met with Maria Romero Peralta, the mother of the juvenile victim, A.R.      She reported that the described suspect, later identified as D.T., had punched her in the left eye and her right breast. With the mother's permission and in her presence, we spoke to the victim, a juvenile male, A.R., who reported that the suspect, D.T., had stolen a red electronic moped bike and had dropped it off at his house. He further reported that the suspect asked the victim if he could drop off the stolen moped for a couple of days. The victim also reported giving the stolen moped bike to another friend since he did not know how to operate the bike. A.R. later noted that the suspect, D.T., recovered the stolen moped bike from the said friend they have in common and had the bike confiscated byLaw Enforcement in another jurisdiction.      Today, the victim reported that the suspect arrived at his residence demanding $400.00 for the moped because it had been confiscated. He further reported that the suspect arrived with three (3) other friends: two Hispanic males, unknown names, dates of birth, or addresses, and a Hispanic female, blonde hair and blue jacket, operating a Toyota Rav 4 with an unknown NY tag. He also reported that a fight ensued between him and the suspect, and the three (3) witnesses stood by.      The victim also reported that his mother, Maria Romero Peralta, heard the commotion and broke up the fight, retreating with the victim and herself back into the residence. A.R. reported that the front entrance door closed and was being held by his mother when the suspect breached the door with physical force and continued to assault the victim while demanding $400.00 for the red moped electric bike.  I then requested a supervisor, and Sgt. Williams responded to assist.     Maria Romero Peralta reported that while attempting to break up the fight, she was punched in the left eye and right breast by the suspect, D.T. She also reported that the suspect and the three (3) witnesses fled the scene after she threatened to call the police. Maria Romero Peralta, along with A.R. declined medical attention at the scene. The mother and the victim wanted to provide statements to detectives and were transported to headquarters by P.O. Alvarez as I followed.      At headquarters, Detectives Mora and Garrett responded to report room 2 and met with the victim and his mother. Before providing statements to the detectives, Maria Romero Peralta began to have complaints of pain in her left eye and right breast. I observed her left eye to be swollen and red. Maria Romero Peralta then requested to be transported to the hospital for evaluation and treatment. I requested an ambulance, and Hackensack University Medical Center BLS #136 arrived. The mother, now a patient, was transported to the HUMC along with A.R. for treatment. The patient reported that she would respond to headquarters at a later time to provide statements to the detectives. I contacted DCP&P Christine #1718 and advised of the incident. She reported that the incident would only be documented. I completed a victim notification form and provided a copy to the victim.It should be noted that the victim, A.R., reported that he had dropped out of school as of today; therefore, a handle with care was not completed. See Detectives report for additional information.",,,,,,,,,,,,,Klosk_J,Complete,P.O. Forrod Bonsu 353,B1,Det. Frankie Garrett 323,Active Investigation,120 = Robbery,9,45670.50347,"On Monday, January 13th, 2025, at approximately 12:07 hours, P.O. Alvarez and I responded to the listed location on a dispute report. Before our arrival, headquarters had advised us that the male suspect, described as wearing a grey hoodie and sweatpants, had fled southbound on First Street. Upon arrival, we met with Maria Romero Peralta, the mother of the juvenile victim, A.R.      She reported that the described suspect, later identified as D.T., had punched her in the left eye and her right breast. With the mother's permission and in her presence, we spoke to the victim, a juvenile male, A.R., who reported that the suspect, D.T., had stolen a red electronic moped bike and had dropped it off at his house. He further reported that the suspect asked the victim if he could drop off the stolen moped for a couple of days. The victim also reported giving the stolen moped bike to another friend since he did not know how to operate the bike. A.R. later noted that the suspect, D.T., recovered the stolen moped bike from the said friend they have in common and had the bike confiscated byLaw Enforcement in another jurisdiction.      Today, the victim reported that the suspect arrived at his residence demanding $400.00 for the moped because it had been confiscated. He further reported that the suspect arrived with three (3) other friends: two Hispanic males, unknown names, dates of birth, or addresses, and a Hispanic female, blonde hair and blue jacket, operating a Toyota Rav 4 with an unknown NY tag. He also reported that a fight ensued between him and the suspect, and the three (3) witnesses stood by.      The victim also reported that his mother, Maria Romero Peralta, heard the commotion and broke up the fight, retreating with the victim and herself back into the residence. A.R. reported that the front entrance door closed and was being held by his mother when the suspect breached the door with physical force and continued to assault the victim while demanding $400.00 for the red moped electric bike.  I then requested a supervisor, and Sgt. Williams responded to assist.     Maria Romero Peralta reported that while attempting to break up the fight, she was punched in the left eye and right breast by the suspect, D.T. She also reported that the suspect and the three (3) witnesses fled the scene after she threatened to call the police. Maria Romero Peralta, along with A.R. declined medical attention at the scene. The mother and the victim wanted to provide statements to detectives and were transported to headquarters by P.O. Alvarez as I followed.      At headquarters, Detectives Mora and Garrett responded to report room 2 and met with the victim and his mother. Before providing statements to the detectives, Maria Romero Peralta began to have complaints of pain in her left eye and right breast. I observed her left eye to be swollen and red. Maria Romero Peralta then requested to be transported to the hospital for evaluation and treatment. I requested an ambulance, and Hackensack University Medical Center BLS #136 arrived. The mother, now a patient, was transported to the HUMC along with A.R. for treatment. The patient reported that she would respond to headquarters at a later time to provide statements to the detectives. I contacted DCP&P Christine #1718 and advised of the incident. She reported that the incident would only be documented. I completed a victim notification form and provided a copy to the victim.It should be noted that the victim, A.R., reported that he had dropped out of school as of today; therefore, a handle with care was not completed. See Detectives report for additional information.",204,01/13/25,12:05,,,01/13/25,12:07
25-003813,1/14/2025,2025,January,01,03,03,Tuesday,014,14,15:00,15:22,Robbery,Robbery,Resisting Arrest/Eluding,Suspicious Person,"Robbery, Resisting Arrest/Eluding, Suspicious Person","Hackensack Ave, 400 Block",450 Hackensack Avenue,"450 Hackensack Avenue, Hackensack, NJ, 07601",I6,9,"On Tuesday, January 14th, 2025, P.O. Conlon. P.O. Voorhis, and I responded to 450 Hackensack Avenue for a report of a trespasser on the premises who had shoplifted in the past and has also been aggressive with staff in the past.    Upon my arrival, I observed the arrestee enter a white Volkswagon (NJ-Y82VDS) that was leaving the parking lot. The security officers at Home Depot also pointed out the arrestee as he entered the car. I conducted a motor vehicle stop with the vehicle at the traffic light exiting the parking lot. As I approached the vehicle, the arrestee exited the vehicle and started running West on Hackensack Avenue. P.O. Conlon, P.O. Voorhis, and I began running after the arrestee and announcing ourselves as Hackensack Police. When the arrestee approached the other side of Hackensack Avenue, he stopped, and P.O. Conlon apprehended him. The arrestee was flailing his arms while I was attempting to place him in handcuffs. The arrestee was then put in handcuffs with his hands behind his back. The arrestee was then searched, which yielded negative for contraband.   The Loss Prevention Officers stated that the arrestee entered the front door of Home Depot with a black ski covering his face. The loss prevention officers noticed the arrestee from previous shoplifting. The arrestee then concealed several power tools totaling $1,284.00 and placed them in a shopping cart. The arrestee then went past all points of sale and tried to exit the store. Prior to exiting the store, the loss prevention officers approached him and tried to stop him from leaving. The arrestee then pushed the loss prevention officers and fled the store on foot. The loss prevention officer recovered the items. The arrestee then entered the listed vehicle and fled the parking lot for the exit of the mall. A photo copy of the receipt was placed into the BCI mailbox located at the front at the front desk.  The items that were recovered: M18 Jobsite Radio priced at $189.00Two 20V Atomic BL Combo Kit priced at $149.00 eachM18 Fuel Jig Saw priced at $199.00MKE M12 Packout Flood Light priced at $149.00M18 Fuel 10 Miter Saw priced at $449.00     Totaling at $1,284.00.The arrestee was placed in radio car 114 and transported to police headquarters for processing. The vehicle was checked before and after the transport for contraband which yielded negative   The arrestee was processed at police headquarters by P.O. Caero. Complaint W-2025-000016 was authored by Lt. Swetits against the arrestee and was signed for 2C:29-2a(1), 2C:29-2a(2), and two counts of 2C:15-1A(1).  The arrestee also had multiple outstanding warrants from various jurisdictions.The arrestee was remanded to the Bergen County Jail.",,,"NJ-Y82VDS VOLKS, ATL",,Y82VDS,VOLKS,ATL,NJ,,,,,Swetits_M,Complete,P.O. Nicholas Mazzaccaro 377,B2,Det. John Tanucilli 335,Active Investigation,120 = Robbery,9,45671.64028,"On Tuesday, January 14th, 2025, P.O. Conlon. P.O. Voorhis, and I responded to 450 Hackensack Avenue for a report of a trespasser on the premises who had shoplifted in the past and has also been aggressive with staff in the past.    Upon my arrival, I observed the arrestee enter a white Volkswagon (NJ-Y82VDS) that was leaving the parking lot. The security officers at Home Depot also pointed out the arrestee as he entered the car. I conducted a motor vehicle stop with the vehicle at the traffic light exiting the parking lot. As I approached the vehicle, the arrestee exited the vehicle and started running West on Hackensack Avenue. P.O. Conlon, P.O. Voorhis, and I began running after the arrestee and announcing ourselves as Hackensack Police. When the arrestee approached the other side of Hackensack Avenue, he stopped, and P.O. Conlon apprehended him. The arrestee was flailing his arms while I was attempting to place him in handcuffs. The arrestee was then put in handcuffs with his hands behind his back. The arrestee was then searched, which yielded negative for contraband.   The Loss Prevention Officers stated that the arrestee entered the front door of Home Depot with a black ski covering his face. The loss prevention officers noticed the arrestee from previous shoplifting. The arrestee then concealed several power tools totaling $1,284.00 and placed them in a shopping cart. The arrestee then went past all points of sale and tried to exit the store. Prior to exiting the store, the loss prevention officers approached him and tried to stop him from leaving. The arrestee then pushed the loss prevention officers and fled the store on foot. The loss prevention officer recovered the items. The arrestee then entered the listed vehicle and fled the parking lot for the exit of the mall. A photo copy of the receipt was placed into the BCI mailbox located at the front at the front desk.  The items that were recovered: M18 Jobsite Radio priced at $189.00Two 20V Atomic BL Combo Kit priced at $149.00 eachM18 Fuel Jig Saw priced at $199.00MKE M12 Packout Flood Light priced at $149.00M18 Fuel 10 Miter Saw priced at $449.00     Totaling at $1,284.00.The arrestee was placed in radio car 114 and transported to police headquarters for processing. The vehicle was checked before and after the transport for contraband which yielded negative   The arrestee was processed at police headquarters by P.O. Caero. Complaint W-2025-000016 was authored by Lt. Swetits against the arrestee and was signed for 2C:29-2a(1), 2C:29-2a(2), and two counts of 2C:15-1A(1).  The arrestee also had multiple outstanding warrants from various jurisdictions.The arrestee was remanded to the Bergen County Jail.",450,01/14/25,15:22,,,01/14/25,15:22
