Case Number,INC_Date,Year,Month Name,Quarter,Week of Year,Week of Month,Day Name,Day of Year,Day,Start of Hour,INC_Time,Target_Incidents,Incident Type_1,Incident Type_2,Incident Type_3,All_Incident_Types,Block,Location,FullAddress,Grid,Zone,Narrative,Total Value Stolen,Total Value Recover,VEHICLE1,VEHICLE2,Registration 1,Make1,Model1,Reg State 1,Registration 2,Reg State 2,Make2,Model2,Reviewed By,CompleteCalc,Officer of Record,Squad,Det_Assigned,Case_Status,NIBRS Classification,OCA_Length,INC_Date_and_Time,Narrative - Copy,Text Before Delimiter,Incident Date,Incident Time,Incident Date_Between,Incident Time_Between,Report Date,Report Time
25-009657,2/3/2025,2025,February,01,06,02,Monday,034,03,18:00,18:30,Motor Vehicle Theft,Motor Vehicle Theft,,,Motor Vehicle Theft,"Midtown Bridge Approach, 0 Block",55 Midtown Bridge Approach,"55 Midtown Bridge Approach, Hackensack, NJ, 07601",H1,8,"I responded to the listed location on a reported motor vehicle theft. Upon arrival, I spoke with the complainant. She stated that on 02/04/2025 at 11:29 hours, she received a text from her boss, asking her to check on one of their U-Haul vehicles. She further stated that upon searching the parking lot, she could not locate the vehicle. The complainant reported that the vehicle had been rented out, so she contacted the contract holder to ensure the vehicle was dropped off. Upon verifying such and checking camera footage, the vehicle is seen on camera being dropped off by the customer. He is then approached by the suspect, where a brief verbal exchange is had. The customer is then seen leaving the area. The suspect is then seen retrieving keys from a lock box, before entering the van and fleeing the area.     I then spoke with the customer. He stated that he had dropped the vehicle off at the listed location at approximately 18:40 hours. He further stated that upon dropping it off, he was greeted by the suspect, who acted as an employee of the business. The customer reported that after a brief discussion, he was wary of the suspect and secured the keys in the lock box himself. He further stated that he then left the area.       A check in house of our tow list was conducted, with the vehicle not having been reported as towed or repossessed.  The complainant was advised of the recovery process, including fingerprinting of the vehicle. The complainant stated that she would like the vehicle held for prints on behalf of U-Haul and signed a Consent to Search Form. The complainant advised that she was unsure if the vehicle had a tracking system.       The vehicle is valued at approximately $45,000.00.            The complainant has video footage of the incident, available upon request.       Vehicle was entered into the ATTF website.    A New Jersey Victim Notification Form was completed.Insurance Info: Self-InsuredCertificate #:S012Exp: 06/30/2025",,,"AZ-AM82732 RAM, PROMASTER",,AM82732,RAM,PROMASTER,AZ,,,,,Deleon_A,Complete,P.O. Micah Gibson 365,A3,Det. Matthew DeBonis 325,Complaint Signed,240 = Theft of Motor Vehicle,9,45691.77083,"I responded to the listed location on a reported motor vehicle theft. Upon arrival, I spoke with the complainant. She stated that on 02/04/2025 at 11:29 hours, she received a text from her boss, asking her to check on one of their U-Haul vehicles. She further stated that upon searching the parking lot, she could not locate the vehicle. The complainant reported that the vehicle had been rented out, so she contacted the contract holder to ensure the vehicle was dropped off. Upon verifying such and checking camera footage, the vehicle is seen on camera being dropped off by the customer. He is then approached by the suspect, where a brief verbal exchange is had. The customer is then seen leaving the area. The suspect is then seen retrieving keys from a lock box, before entering the van and fleeing the area.     I then spoke with the customer. He stated that he had dropped the vehicle off at the listed location at approximately 18:40 hours. He further stated that upon dropping it off, he was greeted by the suspect, who acted as an employee of the business. The customer reported that after a brief discussion, he was wary of the suspect and secured the keys in the lock box himself. He further stated that he then left the area.       A check in house of our tow list was conducted, with the vehicle not having been reported as towed or repossessed.  The complainant was advised of the recovery process, including fingerprinting of the vehicle. The complainant stated that she would like the vehicle held for prints on behalf of U-Haul and signed a Consent to Search Form. The complainant advised that she was unsure if the vehicle had a tracking system.       The vehicle is valued at approximately $45,000.00.            The complainant has video footage of the incident, available upon request.       Vehicle was entered into the ATTF website.    A New Jersey Victim Notification Form was completed.Insurance Info: Self-InsuredCertificate #:S012Exp: 06/30/2025",55,02/03/25,18:30,02/04/25,19:00,02/04/25,12:43
25-009831,2/5/2025,2025,February,01,06,02,Wednesday,036,05,2:00,2:57,Burglary - Commercial,Burglary - Commercial,Alarm - Burglar,,"Burglary - Commercial, Alarm - Burglar","Passaic St, 400 Block",441 Passaic Street,"441 Passaic Street, Hackensack, NJ, 07601",H5,8,"On Wednesday, February 5, 2025 at approximately 0300 hours,  P.O Dominguez and I responded to Hackensack Pharmacy (441 Passaic Street) on a reported activated burglar alarm.   Upon my arrival, I observed the main entrance glass door located on the north side of the business to be shattered.  I also observed a master lock and a metal pin on the ground near the door that appeared to had been cut off the steel roller gate located in front of the glass door. I also observed a white prescription pill bottle on the ground near the master lock.  I advised police communications of my findings and P.O A. Lopez , P.O N. Marza and P.O Mattalian arrived to assist.  A perimeter of the business was immediately established.  P.O Dominguez, P.O N. Marza and I made entry into the business and completed an interior check.  The interior check yielded negative results for any person(s) in the business.  While completing the interior check, I observed two gray large paver stones on the floor near the front glass door.  It appears the two stones were used to break the glass to the front door to gain access.  I observed several white prescription pill bottles on the floor as well as several pairs of eye glasses.  Upon further inspection, I observed a white wooden cabinet located behind the service counter that appeared to have been broken into which contained several white prescription pill bottles similar to the prescription pill bottle located outside on the ground in front of the business.  P.O Dominguez made notification to the tour commander. At approximately 0445 hours, Det. Scarpa and the business owner, Mr. Bodawala, arrived and were updated.  Mr. Bodawala consented to the business to be processed and signed a Consent to Search form.  Mr. Bodawala showed video footage of the incident to Det. Scarpa and e-mailed the footage to Det. Scarpa.  See Det. Scarpa's Supplemental report for further. At 0315 hours, the scene was preserved and a crime log had commenced.-0448 hours, Det. N. LaSala (BCSD-CSU) arrived to process the scene, BCSD case # 2025-0088.-0528 hours, Det. N. LaSala completed processing the scene. The scene was turned over to Mr. Bodawala. Mr. Bodawala advised it is unknown what proceeds/value were taken at this time. He advised once he and his employee conduct and complete an inventory, he will compile a list and forward it to Det. Scarpa. Case turned over to Det. Scarpa.",,,,,,,,,,,,,Swetits_M,Complete,P.O. Benjamin Estrada 350,A2,Det. Frank Scarpa 348,Active Investigation,220 = Burglary/Breaking & Entering,9,45693.12292,"On Wednesday, February 5, 2025 at approximately 0300 hours,  P.O Dominguez and I responded to Hackensack Pharmacy (441 Passaic Street) on a reported activated burglar alarm.   Upon my arrival, I observed the main entrance glass door located on the north side of the business to be shattered.  I also observed a master lock and a metal pin on the ground near the door that appeared to had been cut off the steel roller gate located in front of the glass door. I also observed a white prescription pill bottle on the ground near the master lock.  I advised police communications of my findings and P.O A. Lopez , P.O N. Marza and P.O Mattalian arrived to assist.  A perimeter of the business was immediately established.  P.O Dominguez, P.O N. Marza and I made entry into the business and completed an interior check.  The interior check yielded negative results for any person(s) in the business.  While completing the interior check, I observed two gray large paver stones on the floor near the front glass door.  It appears the two stones were used to break the glass to the front door to gain access.  I observed several white prescription pill bottles on the floor as well as several pairs of eye glasses.  Upon further inspection, I observed a white wooden cabinet located behind the service counter that appeared to have been broken into which contained several white prescription pill bottles similar to the prescription pill bottle located outside on the ground in front of the business.  P.O Dominguez made notification to the tour commander. At approximately 0445 hours, Det. Scarpa and the business owner, Mr. Bodawala, arrived and were updated.  Mr. Bodawala consented to the business to be processed and signed a Consent to Search form.  Mr. Bodawala showed video footage of the incident to Det. Scarpa and e-mailed the footage to Det. Scarpa.  See Det. Scarpa's Supplemental report for further. At 0315 hours, the scene was preserved and a crime log had commenced.-0448 hours, Det. N. LaSala (BCSD-CSU) arrived to process the scene, BCSD case # 2025-0088.-0528 hours, Det. N. LaSala completed processing the scene. The scene was turned over to Mr. Bodawala. Mr. Bodawala advised it is unknown what proceeds/value were taken at this time. He advised once he and his employee conduct and complete an inventory, he will compile a list and forward it to Det. Scarpa. Case turned over to Det. Scarpa.",441,02/05/25,2:57,,,02/05/25,2:57
25-010474,2/7/2025,2025,February,01,06,02,Friday,038,07,6:00,6:35,Motor Vehicle Theft,Motor Vehicle Theft,,,Motor Vehicle Theft,"Hudson St, 100 Block",170 Hudson Street,"170 Hudson Street, Hackensack, NJ, 07601",E2,5,"I responded to the listed location on a motor vehicle theft. Upon arrival, I met with the complainant and the victim. The victim only spoke Spanish, so her husband (the complainant) translated. The complainant stated that his wife's vehicle was parking in the driveway of 170 Hudson Street, which was located between 170 Hudson Street and 166 Hudson Street. He stated that he left his vehicle running and went back into his house at 0635 hours. When he went to check on the vehicle at 0650 hours, he discovered it was missing. The vehicle was left unlocked with the keys in the ignition. I observed cameras in the rear of the house, but none located directly where the vehicle was parked.A victim notification form was completed and a copy was given to the victim. The victim requested to have the vehicle process if located. The estimated value of the stolen auto is $2,000.00 Dollars.",,,"NJ-T12SSE DODGE, CAR",,T12SSE,DODGE,CAR,NJ,,,,,Swetits_M,Complete,P.O. Matthew Tedesco 316,B3,Sgt. Francesco Tripodi 134,No Investigation,240 = Theft of Motor Vehicle,9,45695.27431,"I responded to the listed location on a motor vehicle theft. Upon arrival, I met with the complainant and the victim. The victim only spoke Spanish, so her husband (the complainant) translated. The complainant stated that his wife's vehicle was parking in the driveway of 170 Hudson Street, which was located between 170 Hudson Street and 166 Hudson Street. He stated that he left his vehicle running and went back into his house at 0635 hours. When he went to check on the vehicle at 0650 hours, he discovered it was missing. The vehicle was left unlocked with the keys in the ignition. I observed cameras in the rear of the house, but none located directly where the vehicle was parked.A victim notification form was completed and a copy was given to the victim. The victim requested to have the vehicle process if located. The estimated value of the stolen auto is $2,000.00 Dollars.",170,02/07/25,6:35,02/07/25,6:50,02/07/25,7:22
25-010788,1/31/2025,2025,January,01,05,05,Friday,031,31,12:00,12:00,Motor Vehicle Theft,Motor Vehicle Theft,,,Motor Vehicle Theft,"Hudson St, 500 Block",535 Hudson Street,"535 Hudson Street, Hackensack, NJ, 07601",E3,5,"The victim responded to police headquarters on a report of a motor vehicle theft.  The victim, Clever Asitimbay Mora, reported that he parked the vehicle in the area of 535 Hudson Street in this jurisdiction on 01/31/2025.  The victim reported that on 02/7/2025 at approximately 13:00 hours, he checked the GPS location of his vehicle on his phone and noticed that his vehicle was located at 3945 Frankford Avenue, Philadelphia, PA 19124.  He reported he possessed one (1) key to the vehicle, and the other key was broken.  Both the front and rear license plates were attached to the vehicle.  The victim did not want the vehicle processed if located.  The vehicle is insured by GEICO unknown policy number at this time.  The value of the vehicle is approximately $6,000.00.  A victim notification form was completed, and the vehicle was entered into N.C.I.C and the Auto Theft Task Force (ATTF) as stolen.  I contacted Philadelphia Police Department District 24 and spoke with P.O. Kane and advised him of the location of the vehicle.",,,NJ-S70MPZ,,S70MPZ,,CIV,NJ,,,,,Swetits_M,Complete,P.O. Daniel Francavilla 329,B4,Det. Matthew Dogali 338,Active Investigation,240 = Theft of Motor Vehicle,9,45688.5,"The victim responded to police headquarters on a report of a motor vehicle theft.  The victim, Clever Asitimbay Mora, reported that he parked the vehicle in the area of 535 Hudson Street in this jurisdiction on 01/31/2025.  The victim reported that on 02/7/2025 at approximately 13:00 hours, he checked the GPS location of his vehicle on his phone and noticed that his vehicle was located at 3945 Frankford Avenue, Philadelphia, PA 19124.  He reported he possessed one (1) key to the vehicle, and the other key was broken.  Both the front and rear license plates were attached to the vehicle.  The victim did not want the vehicle processed if located.  The vehicle is insured by GEICO unknown policy number at this time.  The value of the vehicle is approximately $6,000.00.  A victim notification form was completed, and the vehicle was entered into N.C.I.C and the Auto Theft Task Force (ATTF) as stolen.  I contacted Philadelphia Police Department District 24 and spoke with P.O. Kane and advised him of the location of the vehicle.",535,01/31/25,12:00,02/07/25,13:00,02/08/25,9:22
25-003745,1/14/2025,2025,January,01,03,03,Tuesday,014,14,11:00,11:08,Burglary - Residence,Burglary - Residence,Harassment,Domestic Violence,"Burglary - Residence, Harassment, Domestic Violence","Main St, 800 Block",895 Main Street,"895 Main Street, Hackensack, NJ, 07601",I5,9,"On Tuesday, 01/14/2025, P.O. Rivera and I responded to 895 Main Street apartment 12A for a Domestic Violence incident report. Mrs. Charmaine Perez (victim) is the mother of Mr. Christopher Pereira (suspect). Mr. Eusebia Perez (witness) is married to the victim and stepfather to the suspect.      The victim reported that the suspect has not lived at the apartment for approximately three (3) months. The suspect does not have key access to the apartment. There is a vestibule, which is kept locked, that leads to a first and second floor apartment. The victim's apartment is on the first floor.       The victim reported that the suspect broke into the apartment uninvited and continued into her bedroom, where she was located. The suspect was irate, confronted her about money that she was awarded from a lawsuit settlement. The suspect stated, "" BITCH, DON'T MESS WITH THE GRANDKIDS, DO YOU KNOW WHO THAT NIGGA IS ON THE COUCH, STAY THE FUCK AWAY FROM ME!"" The victim reported at the time her granddaughter, Ms. Keka Ornsby, and her boyfriend were seated on the couch when the suspect entered. The victim reported that the suspect did not engage with Ms. Keka Ornsby. It should be noted, Ms. Ornsby's mother has an active temporary restraining order (Docket #FV-02000101-11 against the suspect. Ms. Ornsby is listed as an additional person in the order. The victim reported that Ms. Ornsby began staying with her for approximately three (3) weeks. Due to the statements the victim made, we did not sign a complaint against suspect for 2C:29-9 (Contempt of court).       The victim reported when the suspect exited the bedroom, the granddaughter and her boyfriend left and the witness entered the apartment. The witness reported that he avoided confrontation from the suspect by exiting the apartment. The witness was unaware the suspect was inside and the victim confirmed his reporting. It should be noted, the suspect has a no contact order against the witness (See complaint #W2024-000767-0223). Due to the victim's and witness's statement, we did not sign a complaint against the witness for 2C:29-9 (Contempt of court).      Sgt. Williams arrived to assist. The victim believed the suspect used a credit card to gain entry into the apartment. The vestibule door and apartment door had old damage near the doorknob and strike plate. The victim confirmed our observation. Sgt. Detective Bay was notified. The scene was unable to be processed, but was captured by my body worn camera.      The victim wanted a temporary restraining order and willing to give a recorded statement. She was transported to headquarters, gave a recorded statement to detectives (See their supplement), and Judge Takvorian granted the TRO in report room #2 @1342 hours. Sgt. Feuilly was sent an e-mail to preserve the recording. The victim was given her copy of the TRO. She did not want to speak with a Domestic Violence Response member, but was provided their phone number. A voluntary handwritten form was not completed because she gave a recorded statement. A New Jersey Victim notification form was completed.      Lt. Knapp authored complaint #W-0223-2025-000014 for 2C:33-4C (Harassment), a petty disorderly persons offense, and 2C:18-2A(1) (Burglary), a third degree crime.",,,,,,,,,,,,,Knapp_J,Complete,P.O. Kevin Small 328,B2,Det. John Tanucilli 335,Complaint Signed,220 = Burglary/Breaking & Entering,9,45671.46389,"On Tuesday, 01/14/2025, P.O. Rivera and I responded to 895 Main Street apartment 12A for a Domestic Violence incident report. Mrs. Charmaine Perez (victim) is the mother of Mr. Christopher Pereira (suspect). Mr. Eusebia Perez (witness) is married to the victim and stepfather to the suspect.      The victim reported that the suspect has not lived at the apartment for approximately three (3) months. The suspect does not have key access to the apartment. There is a vestibule, which is kept locked, that leads to a first and second floor apartment. The victim's apartment is on the first floor.       The victim reported that the suspect broke into the apartment uninvited and continued into her bedroom, where she was located. The suspect was irate, confronted her about money that she was awarded from a lawsuit settlement. The suspect stated, "" BITCH, DON'T MESS WITH THE GRANDKIDS, DO YOU KNOW WHO THAT NIGGA IS ON THE COUCH, STAY THE FUCK AWAY FROM ME!"" The victim reported at the time her granddaughter, Ms. Keka Ornsby, and her boyfriend were seated on the couch when the suspect entered. The victim reported that the suspect did not engage with Ms. Keka Ornsby. It should be noted, Ms. Ornsby's mother has an active temporary restraining order (Docket #FV-02000101-11 against the suspect. Ms. Ornsby is listed as an additional person in the order. The victim reported that Ms. Ornsby began staying with her for approximately three (3) weeks. Due to the statements the victim made, we did not sign a complaint against suspect for 2C:29-9 (Contempt of court).       The victim reported when the suspect exited the bedroom, the granddaughter and her boyfriend left and the witness entered the apartment. The witness reported that he avoided confrontation from the suspect by exiting the apartment. The witness was unaware the suspect was inside and the victim confirmed his reporting. It should be noted, the suspect has a no contact order against the witness (See complaint #W2024-000767-0223). Due to the victim's and witness's statement, we did not sign a complaint against the witness for 2C:29-9 (Contempt of court).      Sgt. Williams arrived to assist. The victim believed the suspect used a credit card to gain entry into the apartment. The vestibule door and apartment door had old damage near the doorknob and strike plate. The victim confirmed our observation. Sgt. Detective Bay was notified. The scene was unable to be processed, but was captured by my body worn camera.      The victim wanted a temporary restraining order and willing to give a recorded statement. She was transported to headquarters, gave a recorded statement to detectives (See their supplement), and Judge Takvorian granted the TRO in report room #2 @1342 hours. Sgt. Feuilly was sent an e-mail to preserve the recording. The victim was given her copy of the TRO. She did not want to speak with a Domestic Violence Response member, but was provided their phone number. A voluntary handwritten form was not completed because she gave a recorded statement. A New Jersey Victim notification form was completed.      Lt. Knapp authored complaint #W-0223-2025-000014 for 2C:33-4C (Harassment), a petty disorderly persons offense, and 2C:18-2A(1) (Burglary), a third degree crime.",895,01/14/25,11:08,,,01/14/25,11:13
