Case Number,INC_Date,Year,Month Name,Quarter,Week of Year,Week of Month,Day Name,Day of Year,Day,Start of Hour,INC_Time,Target_Incidents,Incident Type_1,Incident Type_2,Incident Type_3,All_Incident_Types,Block,Location,FullAddress,Grid,Zone,Narrative,Total Value Stolen,Total Value Recover,VEHICLE1,VEHICLE2,Registration 1,Make1,Model1,Reg State 1,Registration 2,Reg State 2,Make2,Model2,Reviewed By,CompleteCalc,Officer of Record,Squad,Det_Assigned,Case_Status,NIBRS Classification,OCA_Length,INC_Date_and_Time,Narrative - Copy,Text Before Delimiter,Incident Date,Incident Time,Incident Date_Between,Incident Time_Between,Report Date,Report Time
25-007074,1/25/2025,2025,January,01,04,04,Saturday,025,25,18:00,18:27,Burglary - Auto,Burglary - Auto,Theft,,"Burglary - Auto, Theft","Stanley Pl, 200 Block",206 Stanley Place,"206 Stanley Place, Hackensack, NJ, 07601",H3,8,"Suspect description: Possibly male, approximately 5'7'' in height, with a slim build. On 1/26/25 P.O. Papanikolaou and I responded to 206 Stanley Place on a reported theft from auto. Upon arrival, I spoke with the victim, Phyllis Cunningham. The victim reported on 1/25/25 at approximately 20:52 hours she received a text message from her son. The text was a video of an unknown suspect entering her vehicle, New Jersey Registration R36GBB. The listed vehicle was parked in the driveway at 206 Stanley Place. The victim showed me the video that her son texted her. Upon observing the video I observed on 1/25/25 at 18:27 hours the suspect entered the vehicle from the front driver side door, which was left insecure. Later, the suspect was seen on video to be searching through the vehicle. After the incident the victim responded to check her vehicle. Upon inspecting her vehicle nothing appeared to be stolen and no damage was observed. A New Jersey victim notification form was completed. The victim did not request to have the vehicle processed. At this time the victim reported if the suspect could be identified she would pursue a criminal case.  The victim was advised to save the video surveillance of the incident. Sgt. Competiello was advised.",,,"NJ-R36GBB HONDA, CRV",,R36GBB,HONDA,CRV,NJ,,,,,Levis_R,Complete,P.O. Massimo Gallorini 379,A2,Sgt. Franklin Bay 162,No Investigation,23F = Theft From Motor Vehicle,9,45682.76875,"Suspect description: Possibly male, approximately 5'7'' in height, with a slim build. On 1/26/25 P.O. Papanikolaou and I responded to 206 Stanley Place on a reported theft from auto. Upon arrival, I spoke with the victim, Phyllis Cunningham. The victim reported on 1/25/25 at approximately 20:52 hours she received a text message from her son. The text was a video of an unknown suspect entering her vehicle, New Jersey Registration R36GBB. The listed vehicle was parked in the driveway at 206 Stanley Place. The victim showed me the video that her son texted her. Upon observing the video I observed on 1/25/25 at 18:27 hours the suspect entered the vehicle from the front driver side door, which was left insecure. Later, the suspect was seen on video to be searching through the vehicle. After the incident the victim responded to check her vehicle. Upon inspecting her vehicle nothing appeared to be stolen and no damage was observed. A New Jersey victim notification form was completed. The victim did not request to have the vehicle processed. At this time the victim reported if the suspect could be identified she would pursue a criminal case.  The victim was advised to save the video surveillance of the incident. Sgt. Competiello was advised.",206,01/25/25,18:27,,,01/26/25,10:34
25-007197,1/26/2025,2025,January,01,05,05,Sunday,026,26,20:00,20:10,Burglary - Auto,Burglary - Auto,Theft,,"Burglary - Auto, Theft","Pangborn Pl, 0 Block",5 Pangborn Place,"5 Pangborn Place, Hackensack, NJ, 07601",H2,9,"I responded to the listed location on a reported theft from a motor vehicle. Sgt. Farhi responded to assist. Upon arrival, I spoke with the complainant. She stated that on 01/26/2025 at approximately 20:10 hours, she had turned her vehicle on to heat up. She further stated that she had left the vehicle running with the keys inside when she returned to her apartment for a few moments. The complainant reported that when she returned to the vehicle, the vehicle was still there but the keys were missing.       The complainant stated that no other items appeared to be missing from the vehicle. Furthermore, due to contamination by the complainant, the vehicle was unable to be processed.    The complainant stated that the value of the key fob is approximately $200.00.    The vehicle was parked on Conklin Place, 150 feet east of Pangborn Place, facing west.    A check of the area for cameras revealed one on the Bergen Christian Academies.       A New Jersey Victim Notification Form was completed and provided to the complainant. She was further advised on how to obtain a copy of this report.  Detective Garrett was notified.Vehicle Insurance: GeicoCode :365Policy Number: 6164-87-88-42",,,"NJ-R97RYW HONDA, ODY",,R97RYW,HONDA,ODY,NJ,,,,,Deleon_A,Complete,P.O. Micah Gibson 365,A3,Det. Matthew Dogali 338,Active Investigation,23F = Theft From Motor Vehicle,9,45683.84028,"I responded to the listed location on a reported theft from a motor vehicle. Sgt. Farhi responded to assist. Upon arrival, I spoke with the complainant. She stated that on 01/26/2025 at approximately 20:10 hours, she had turned her vehicle on to heat up. She further stated that she had left the vehicle running with the keys inside when she returned to her apartment for a few moments. The complainant reported that when she returned to the vehicle, the vehicle was still there but the keys were missing.       The complainant stated that no other items appeared to be missing from the vehicle. Furthermore, due to contamination by the complainant, the vehicle was unable to be processed.    The complainant stated that the value of the key fob is approximately $200.00.    The vehicle was parked on Conklin Place, 150 feet east of Pangborn Place, facing west.    A check of the area for cameras revealed one on the Bergen Christian Academies.       A New Jersey Victim Notification Form was completed and provided to the complainant. She was further advised on how to obtain a copy of this report.  Detective Garrett was notified.Vehicle Insurance: GeicoCode :365Policy Number: 6164-87-88-42",5,01/26/25,20:10,01/26/25,20:19,01/26/25,20:24
25-008075,1/28/2025,2025,January,01,05,05,Tuesday,028,28,15:00,15:00,Motor Vehicle Theft,Motor Vehicle Theft,Theft,,"Motor Vehicle Theft, Theft","Essex St, 100 Block",119 Essex Street,"119 Essex Street, Hackensack, NJ, 07601",F1,6,"On January 29, 2025, I responded to the listed location on a report on a stolen motor vehicle. Upon arrival, I met with the registered owner, Trina Coley. The registered owner stated on January 28, 2025 during the afternoon hours she parked her vehicle , a 2012 Lexus ES color black bearing NJ registration K84CXU in her residence private parking lot facing East. The registered owner stated that she currently does not have possession of the key fob as it was left inside of the vehicle along with her cell phone. At approximately 0930 hours on January 29, 2025 she responded to her vehicle where she last parked it,and the vehicle was no longer there.       The registered owner received a completed victim notification. The vehicle was entered as stolen into NCIC (NIC #V686695547 ) along with a stolen motor vehicle form. The vehicle was also entered as stolen into the ATTF web site. The registered owner does not wish to have the vehicle processed at this time. Approximate value for the above vehicle is 7,000.00 USD and the iPhone 15 at $800.00 USD.",,,"NJ-K84CXU LEXUS, ES",,K84CXU,LEXUS,ES,NJ,,,,,Swetits_M,Complete,P.O. Roselys Salas 369,B4,Det. Matthew DeBonis 325,Ex-Cleared / Closed,240 = Theft of Motor Vehicle,9,45685.625,"On January 29, 2025, I responded to the listed location on a report on a stolen motor vehicle. Upon arrival, I met with the registered owner, Trina Coley. The registered owner stated on January 28, 2025 during the afternoon hours she parked her vehicle , a 2012 Lexus ES color black bearing NJ registration K84CXU in her residence private parking lot facing East. The registered owner stated that she currently does not have possession of the key fob as it was left inside of the vehicle along with her cell phone. At approximately 0930 hours on January 29, 2025 she responded to her vehicle where she last parked it,and the vehicle was no longer there.       The registered owner received a completed victim notification. The vehicle was entered as stolen into NCIC (NIC #V686695547 ) along with a stolen motor vehicle form. The vehicle was also entered as stolen into the ATTF web site. The registered owner does not wish to have the vehicle processed at this time. Approximate value for the above vehicle is 7,000.00 USD and the iPhone 15 at $800.00 USD.",119,01/28/25,15:00,01/29/25,22:01,01/29/25,22:02
25-008551,1/31/2025,2025,January,01,05,05,Friday,031,31,11:00,11:59,Burglary - Residence,Burglary - Residence,,,Burglary - Residence,"The Esplanade, 200 Block",292 The Esplanade,"292 The Esplanade, Hackensack, NJ, 07601",H5,8,"On January 31, 2025, at approximately 1200 hours the victim responded to Hackensack Police Department Headquarters for a report of a burglary to his residence that occurred in the past. I met with the victim who reported that last Friday, January 24, 2025 at approximately 1200 hours he left his residence with his wife and son for the day. He reported that upon his return to his residence at approximately 1500 hours, he observed the front door (allows entry into the apartment) wide open.  He further reported that he believes he locked the door before he left but did not observe any damage to his door. He reported that he went inside his residence to check if anyone was in his apartment with negative results. The victim reported that the following day, Saturday, January 25, 2025, he looked for his beige folder that contained copies and originals of the following items: passport, social security cards, and licenses of his wife, Arelis Bonilla, and his sons, Eduardo M. Sobrino and Edwin D. Sobrino-Bonilla.       The victim reported that he last saw his beige folder with those documents in his living room approximately one month ago. The victim was advised to contact the social security administration, DMV, and credit companies to advise them of the above. He was also advised on how to obtain new copies of his social security card, license, and passport. The victim was advised to report any fraudulent activity he may see.       A New Jersey Victim Notification Form was completed and a copy was provided to the victim. He was advised to contact Hackensack Police Department should another incident like this arise.       The victim was not offered B.C.I. to respond to the residence due to the apartment being contaminated for approximately a week. Det. Lt. Weber was notified.",,,,,,,,,,,,,Klosk_J,Complete,P.O. Denisse Caero 367,B2,Det. John Tanucilli 335,Active/Administratively Closed,220 = Burglary/Breaking & Entering,9,45688.49931,"On January 31, 2025, at approximately 1200 hours the victim responded to Hackensack Police Department Headquarters for a report of a burglary to his residence that occurred in the past. I met with the victim who reported that last Friday, January 24, 2025 at approximately 1200 hours he left his residence with his wife and son for the day. He reported that upon his return to his residence at approximately 1500 hours, he observed the front door (allows entry into the apartment) wide open.  He further reported that he believes he locked the door before he left but did not observe any damage to his door. He reported that he went inside his residence to check if anyone was in his apartment with negative results. The victim reported that the following day, Saturday, January 25, 2025, he looked for his beige folder that contained copies and originals of the following items: passport, social security cards, and licenses of his wife, Arelis Bonilla, and his sons, Eduardo M. Sobrino and Edwin D. Sobrino-Bonilla.       The victim reported that he last saw his beige folder with those documents in his living room approximately one month ago. The victim was advised to contact the social security administration, DMV, and credit companies to advise them of the above. He was also advised on how to obtain new copies of his social security card, license, and passport. The victim was advised to report any fraudulent activity he may see.       A New Jersey Victim Notification Form was completed and a copy was provided to the victim. He was advised to contact Hackensack Police Department should another incident like this arise.       The victim was not offered B.C.I. to respond to the residence due to the apartment being contaminated for approximately a week. Det. Lt. Weber was notified.",292,01/31/25,11:59,,,01/31/25,11:59
25-008777,2/1/2025,2025,February,01,05,01,Saturday,032,01,1:00,1:00,Motor Vehicle Theft,Motor Vehicle Theft,,,Motor Vehicle Theft,"Sutton Ave, 400 Block",453 Sutton Avenue,"453 Sutton Avenue, Hackensack, NJ, 07601",F2,6,"On February 1, 2025, I responded to the listed location on a report on a stolen motor vehicle. Upon arrival, I met with the registered owner, Mohammed Almowail. The registered owner stated on February 1, 2025 at approximately 0100 hours he parked his vehicle, a 2012 Ford Crown Victoria color grey bearing NJ registration P77UZJ in front of 453 Sutton Avenue facing East. At approximately 0230 hours, while inside of the residence he heard the vehicle being turned on and when he walked out to where he last parked it the vehicle was no longer there.      The registered owner stated that he currently has possession of the two keys that belong to the vehicle. The vehicle has two NJ plates(P77UZJ) attached.     It should be noted the victim was in the process of selling the vehicle today to someone by the alias of Taylor Jacobs via Facebook marketplace. The victim provided the above listed address and videos of where the vehicle was going to be located to the above listed alias of Taylor Jacobs.     The vehicle also contained a black wallet inside with three Bank of America Credit Cards and 4 Bank of Kuwaitt Credit Cards issued to Abdull Alhajeri. The victim was advised to report and lock all cards.      The registered owner received a completed victim notification. The vehicle was entered as stolen into NCIC (NIC # V786677145 ) along with a stolen motor vehicle form. The vehicle was also entered as stolen into the  ATTF site. The registered owner does not wish to have the vehicle processed at this time. Approximate value for the above vehicle is 3,000.00 USD. The value of the black wallet is approximately $30.00 USD.",,,"NJ-P77UZJ FORD, CRO",,P77UZJ,FORD,CRO,NJ,,,,,Swetits_M,Complete,P.O. Roselys Salas 369,B4,Det. Demetrius Carroll 133,Active/Administratively Closed,240 = Theft of Motor Vehicle,9,45689.04167,"On February 1, 2025, I responded to the listed location on a report on a stolen motor vehicle. Upon arrival, I met with the registered owner, Mohammed Almowail. The registered owner stated on February 1, 2025 at approximately 0100 hours he parked his vehicle, a 2012 Ford Crown Victoria color grey bearing NJ registration P77UZJ in front of 453 Sutton Avenue facing East. At approximately 0230 hours, while inside of the residence he heard the vehicle being turned on and when he walked out to where he last parked it the vehicle was no longer there.      The registered owner stated that he currently has possession of the two keys that belong to the vehicle. The vehicle has two NJ plates(P77UZJ) attached.     It should be noted the victim was in the process of selling the vehicle today to someone by the alias of Taylor Jacobs via Facebook marketplace. The victim provided the above listed address and videos of where the vehicle was going to be located to the above listed alias of Taylor Jacobs.     The vehicle also contained a black wallet inside with three Bank of America Credit Cards and 4 Bank of Kuwaitt Credit Cards issued to Abdull Alhajeri. The victim was advised to report and lock all cards.      The registered owner received a completed victim notification. The vehicle was entered as stolen into NCIC (NIC # V786677145 ) along with a stolen motor vehicle form. The vehicle was also entered as stolen into the  ATTF site. The registered owner does not wish to have the vehicle processed at this time. Approximate value for the above vehicle is 3,000.00 USD. The value of the black wallet is approximately $30.00 USD.",453,02/01/25,1:00,,2:30,02/01/25,2:52
25-009348,2/2/2025,2025,February,01,06,02,Sunday,033,02,17:00,17:25,Robbery,Suspicious Incident,Robbery,,"Suspicious Incident, Robbery","Hudson St, 100 Block",144 Hudson Street,"144 Hudson Street, Hackensack, NJ, 07601",E1,5,"Unknown Suspect Descriptions:Unknown Suspect 1: Tall white male, crew cut, no clothing descriptionUnknown Suspects 2-5: 4 males, unknown race, wearing dark colored helmets and dark clothes with padding.         While in the area, P.O. Maceri and I were flagged down by the victim. Upon speaking with him, he advised that he had been robbed. Sgt. Farhi responded to assist.          The victim stated that on 02/02/2025 between 17:25 and 18:00 hours, he was walking north on Main Street, near the area of Main Street and Court Street with two acquaintances. He further stated that while walking in that area, a verbal dispute took place between the three of them. The victim reported that at this time, he was approached by five suspects, with four of them carrying bats. He further reported that suspect #1 threatened him, stating that he would beat him up if he didn't hand over his belongings. The victim stated that suspect #1 forcibly retrieved the wallet off his person and removed a debit card and identification card, before throwing the wallet back in his direction. He further stated that the suspect's then told him if they saw him again, they would beat him up. The suspects then fled east on Court Street, before turning left to head north on River Road.        A New Jersey Victim Notification Form was completed and provided to the victim.       The detective division was notified and advised that they would follow up with the victim.",,,,,,,,,,,,,Deleon_A,Complete,P.O. Micah Gibson 365,A3,Sgt. Francesco Tripodi 134,No Investigation,,9,45690.72569,"Unknown Suspect Descriptions:Unknown Suspect 1: Tall white male, crew cut, no clothing descriptionUnknown Suspects 2-5: 4 males, unknown race, wearing dark colored helmets and dark clothes with padding.         While in the area, P.O. Maceri and I were flagged down by the victim. Upon speaking with him, he advised that he had been robbed. Sgt. Farhi responded to assist.          The victim stated that on 02/02/2025 between 17:25 and 18:00 hours, he was walking north on Main Street, near the area of Main Street and Court Street with two acquaintances. He further stated that while walking in that area, a verbal dispute took place between the three of them. The victim reported that at this time, he was approached by five suspects, with four of them carrying bats. He further reported that suspect #1 threatened him, stating that he would beat him up if he didn't hand over his belongings. The victim stated that suspect #1 forcibly retrieved the wallet off his person and removed a debit card and identification card, before throwing the wallet back in his direction. He further stated that the suspect's then told him if they saw him again, they would beat him up. The suspects then fled east on Court Street, before turning left to head north on River Road.        A New Jersey Victim Notification Form was completed and provided to the victim.       The detective division was notified and advised that they would follow up with the victim.",144,02/02/25,17:25,02/02/25,18:00,02/03/25,12:02
25-009438,2/3/2025,2025,February,01,06,02,Monday,034,03,16:00,16:40,Robbery,Robbery,,,Robbery,"Hackensack Ave, 400 Block",400 Hackensack Avenue,"400 Hackensack Avenue, Hackensack, NJ, 07601",I6,9,"On Monday, February 3, 2025 at approximately 1640 hours, Sgt. Farhi and I responded to 400 Hackensack Avenue (Marc Jacobs) on a reported robbery. Upon arrival, I met with the victim who reported that three suspects (1 male, 2 females) entered the establishment at approximately 1600 hours. The suspects reportedly exited and reentered the store multiples time prior to committing the offense, with the last entry being made only by the male suspect.     The victim further reported that the suspect grabbed three small purses from the display shelf before he began to walk toward the exit. At that time, the victim stated that he attempted to stop the suspect, who immediately shoved him into a store fixture. The suspect reportedly proceeded to run out of the store toward the nearest mall exit, where he entered a black vehicle and fled in an unknown direction. The victim stated that he was able to recover one of the purses during the incident.     The victim advised that he sustained minor injuries to his left arm as result of the incident, in which he refused any medical attention. The victim wished to provide a recorded statement to detectives. He was transported to police headquarters where he was turned over to Det. Dogali. The total loss suffered by the establishment for the two purses was approximately $650.00. The store manager (witness) wished to have complaints signed against the suspects if they were able to be identified.     Suspect 1: Black male, slim build, 5'8"", black beanie, black puffer, dark pants, white/blue sneakers     Suspect 2: Black female, heavy build, 5'8"", short hair, black puffer, black leggings, black pocketbook     Suspect 3: Black female, heavy build, 5'7"", long cornrows, gray puffer, light blue jeans",,,,,,,,,,,,,Levis_R,Complete,P.O. Aziah Miller 357,A3,Det. Matthew Dogali 338,Active/Administratively Closed,120 = Robbery,9,45691.69444,"On Monday, February 3, 2025 at approximately 1640 hours, Sgt. Farhi and I responded to 400 Hackensack Avenue (Marc Jacobs) on a reported robbery. Upon arrival, I met with the victim who reported that three suspects (1 male, 2 females) entered the establishment at approximately 1600 hours. The suspects reportedly exited and reentered the store multiples time prior to committing the offense, with the last entry being made only by the male suspect.     The victim further reported that the suspect grabbed three small purses from the display shelf before he began to walk toward the exit. At that time, the victim stated that he attempted to stop the suspect, who immediately shoved him into a store fixture. The suspect reportedly proceeded to run out of the store toward the nearest mall exit, where he entered a black vehicle and fled in an unknown direction. The victim stated that he was able to recover one of the purses during the incident.     The victim advised that he sustained minor injuries to his left arm as result of the incident, in which he refused any medical attention. The victim wished to provide a recorded statement to detectives. He was transported to police headquarters where he was turned over to Det. Dogali. The total loss suffered by the establishment for the two purses was approximately $650.00. The store manager (witness) wished to have complaints signed against the suspects if they were able to be identified.     Suspect 1: Black male, slim build, 5'8"", black beanie, black puffer, dark pants, white/blue sneakers     Suspect 2: Black female, heavy build, 5'8"", short hair, black puffer, black leggings, black pocketbook     Suspect 3: Black female, heavy build, 5'7"", long cornrows, gray puffer, light blue jeans",400,,,,,02/03/25,16:40
