Case Number,INC_Date,Year,Month Name,Quarter,Week of Year,Week of Month,Day Name,Day of Year,Day,Start of Hour,INC_Time,Target_Incidents,Incident Type_1,Incident Type_2,Incident Type_3,All_Incident_Types,Block,Location,FullAddress,Grid,Zone,Narrative,Total Value Stolen,Total Value Recover,VEHICLE1,VEHICLE2,Registration 1,Make1,Model1,Reg State 1,Registration 2,Reg State 2,Make2,Model2,Reviewed By,CompleteCalc,Officer of Record,Squad,Det_Assigned,Case_Status,NIBRS Classification,OCA_Length,INC_Date_and_Time,Narrative - Copy,Text Before Delimiter,Incident Date,Incident Time,Incident Date_Between,Incident Time_Between,Report Date,Report Time
25-003362,01/13/25,2025,January,01,03,03,Monday,013,13,12:00,12:05,Robbery,Dispute,Criminal Attempt,Robbery,"Dispute, Criminal Attempt, Robbery","Clay St, 200 Block",204 Clay Street,"204 Clay Street, Hackensack, NJ, 07601",H3,8,"On Monday, January 13th, 2025, at approximately 12:07 hours, P.O. Alvarez and I responded to the listed location on a dispute report. Before our arrival, headquarters had advised us that the male suspect, described as wearing a grey hoodie and sweatpants, had fled southbound on First Street. Upon arrival, we met with Maria Romero Peralta, the mother of the juvenile victim, A.R.      She reported that the described suspect, later identified as D.T., had punched her in the left eye and her right breast. With the mother's permission and in her presence, we spoke to the victim, a juvenile male, A.R., who reported that the suspect, D.T., had stolen a red electronic moped bike and had dropped it off at his house. He further reported that the suspect asked the victim if he could drop off the stolen moped for a couple of days. The victim also reported giving the stolen moped bike to another friend since he did not know how to operate the bike. A.R. later noted that the suspect, D.T., recovered the stolen moped bike from the said friend they have in common and had the bike confiscated byLaw Enforcement in another jurisdiction.      Today, the victim reported that the suspect arrived at his residence demanding $400.00 for the moped because it had been confiscated. He further reported that the suspect arrived with three (3) other friends: two Hispanic males, unknown names, dates of birth, or addresses, and a Hispanic female, blonde hair and blue jacket, operating a Toyota Rav 4 with an unknown NY tag. He also reported that a fight ensued between him and the suspect, and the three (3) witnesses stood by.      The victim also reported that his mother, Maria Romero Peralta, heard the commotion and broke up the fight, retreating with the victim and herself back into the residence. A.R. reported that the front entrance door closed and was being held by his mother when the suspect breached the door with physical force and continued to assault the victim while demanding $400.00 for the red moped electric bike.  I then requested a supervisor, and Sgt. Williams responded to assist.     Maria Romero Peralta reported that while attempting to break up the fight, she was punched in the left eye and right breast by the suspect, D.T. She also reported that the suspect and the three (3) witnesses fled the scene after she threatened to call the police. Maria Romero Peralta, along with A.R. declined medical attention at the scene. The mother and the victim wanted to provide statements to detectives and were transported to headquarters by P.O. Alvarez as I followed.      At headquarters, Detectives Mora and Garrett responded to report room 2 and met with the victim and his mother. Before providing statements to the detectives, Maria Romero Peralta began to have complaints of pain in her left eye and right breast. I observed her left eye to be swollen and red. Maria Romero Peralta then requested to be transported to the hospital for evaluation and treatment. I requested an ambulance, and Hackensack University Medical Center BLS #136 arrived. The mother, now a patient, was transported to the HUMC along with A.R. for treatment. The patient reported that she would respond to headquarters at a later time to provide statements to the detectives. I contacted DCP&P Christine #1718 and advised of the incident. She reported that the incident would only be documented. I completed a victim notification form and provided a copy to the victim.It should be noted that the victim, A.R., reported that he had dropped out of school as of today; therefore, a handle with care was not completed. See Detectives report for additional information.",,,,,,,,,,,,,Klosk_J,Complete,P.O. Forrod Bonsu 353,B1,Det. Frankie Garrett 323,Active Investigation,120 = Robbery,9,01/13/25 12:05,"On Monday, January 13th, 2025, at approximately 12:07 hours, P.O. Alvarez and I responded to the listed location on a dispute report. Before our arrival, headquarters had advised us that the male suspect, described as wearing a grey hoodie and sweatpants, had fled southbound on First Street. Upon arrival, we met with Maria Romero Peralta, the mother of the juvenile victim, A.R.      She reported that the described suspect, later identified as D.T., had punched her in the left eye and her right breast. With the mother's permission and in her presence, we spoke to the victim, a juvenile male, A.R., who reported that the suspect, D.T., had stolen a red electronic moped bike and had dropped it off at his house. He further reported that the suspect asked the victim if he could drop off the stolen moped for a couple of days. The victim also reported giving the stolen moped bike to another friend since he did not know how to operate the bike. A.R. later noted that the suspect, D.T., recovered the stolen moped bike from the said friend they have in common and had the bike confiscated byLaw Enforcement in another jurisdiction.      Today, the victim reported that the suspect arrived at his residence demanding $400.00 for the moped because it had been confiscated. He further reported that the suspect arrived with three (3) other friends: two Hispanic males, unknown names, dates of birth, or addresses, and a Hispanic female, blonde hair and blue jacket, operating a Toyota Rav 4 with an unknown NY tag. He also reported that a fight ensued between him and the suspect, and the three (3) witnesses stood by.      The victim also reported that his mother, Maria Romero Peralta, heard the commotion and broke up the fight, retreating with the victim and herself back into the residence. A.R. reported that the front entrance door closed and was being held by his mother when the suspect breached the door with physical force and continued to assault the victim while demanding $400.00 for the red moped electric bike.  I then requested a supervisor, and Sgt. Williams responded to assist.     Maria Romero Peralta reported that while attempting to break up the fight, she was punched in the left eye and right breast by the suspect, D.T. She also reported that the suspect and the three (3) witnesses fled the scene after she threatened to call the police. Maria Romero Peralta, along with A.R. declined medical attention at the scene. The mother and the victim wanted to provide statements to detectives and were transported to headquarters by P.O. Alvarez as I followed.      At headquarters, Detectives Mora and Garrett responded to report room 2 and met with the victim and his mother. Before providing statements to the detectives, Maria Romero Peralta began to have complaints of pain in her left eye and right breast. I observed her left eye to be swollen and red. Maria Romero Peralta then requested to be transported to the hospital for evaluation and treatment. I requested an ambulance, and Hackensack University Medical Center BLS #136 arrived. The mother, now a patient, was transported to the HUMC along with A.R. for treatment. The patient reported that she would respond to headquarters at a later time to provide statements to the detectives. I contacted DCP&P Christine #1718 and advised of the incident. She reported that the incident would only be documented. I completed a victim notification form and provided a copy to the victim.It should be noted that the victim, A.R., reported that he had dropped out of school as of today; therefore, a handle with care was not completed. See Detectives report for additional information.",204,01/13/25,12:05,,,1/13/2025,12:07:44
25-004097,01/15/25,2025,January,01,03,03,Wednesday,015,15,12:00,12:57,Motor Vehicle Theft,Motor Vehicle Theft,,,Motor Vehicle Theft,"First St, 200 Block",244 First Street,"244 First Street, Hackensack, NJ, 07601",H3,8,"On 01/15/2025 I responded to 244 First Street on a reported motor vehicle theft. Upon arrival I met with the driver of the stolen vehicle, Jeffrey Mejiamorquecho. He reported he parked his motor vehicle in front of 244 First Street facing north at around 24:00 hours. He further reported his mother left his residence at 05:00 hours on the listed date and noticed the vehicle was gone. The driver also reported he received a notification from EZ Pass with a charge from the George Washington Bridge toll at 04:13 hours on the listed date. The driver then walked out with me to where his vehicle was parked and observed broken glass which he suspected to be from his rear passenger side window. The driver advised me the vehicle had 1 plate in the rear and was worth approximately $50,000.00 as the vehicle was fairly new. He further reported he attempted to track the vehicle as it contains tracking equipment but was unsuccessful as it was not connecting. He believes it was disconnected somehow after the vehicle was stolen.240 First Street has cameras in the general direction of where the vehicle was parked. It is unknown at this time if they captured the incident occur.Insurance Information: Company: Geico (369)Policy Number: 6183163036The driver was provided with a completed New Jersey Victim Notification Form.The driver wished to have the vehicle processed if located and a Hackensack Police Consent to Search from was completed.The vehicle was entered into NCIC as stolen by Communications.The vehicle was entered into ATTF as stolen.",,,"NJ-U38ULG HONDA, CIV",,U38ULG,HONDA,CIV,NJ,,,,,Swetits_M,Complete,P.O. Frank Lorenzo 371,B1,Det. Matthew DeBonis 325,Active/Administratively Closed,240 = Theft of Motor Vehicle,9,01/15/25 12:57,"On 01/15/2025 I responded to 244 First Street on a reported motor vehicle theft. Upon arrival I met with the driver of the stolen vehicle, Jeffrey Mejiamorquecho. He reported he parked his motor vehicle in front of 244 First Street facing north at around 24:00 hours. He further reported his mother left his residence at 05:00 hours on the listed date and noticed the vehicle was gone. The driver also reported he received a notification from EZ Pass with a charge from the George Washington Bridge toll at 04:13 hours on the listed date. The driver then walked out with me to where his vehicle was parked and observed broken glass which he suspected to be from his rear passenger side window. The driver advised me the vehicle had 1 plate in the rear and was worth approximately $50,000.00 as the vehicle was fairly new. He further reported he attempted to track the vehicle as it contains tracking equipment but was unsuccessful as it was not connecting. He believes it was disconnected somehow after the vehicle was stolen.240 First Street has cameras in the general direction of where the vehicle was parked. It is unknown at this time if they captured the incident occur.Insurance Information: Company: Geico (369)Policy Number: 6183163036The driver was provided with a completed New Jersey Victim Notification Form.The driver wished to have the vehicle processed if located and a Hackensack Police Consent to Search from was completed.The vehicle was entered into NCIC as stolen by Communications.The vehicle was entered into ATTF as stolen.",244,01/15/25,12:57,,,1/15/2025,12:57:26
25-006324,01/23/25,2025,January,01,04,04,Thursday,023,23,15:00,15:00,Sexual Assault,Sexual Assault,Juvenile Investigation,,"Sexual Assault, Juvenile Investigation","Berdan Pl, 100 Block",176  Berdan Place,"176  Berdan Place, Hackensack, NJ, 07601",H3,8,"On Thursday, 01/23/2025 I was notified by D/Sgt. Dominguez of a possible sexual assault involving a juvenile. I was advised that 10 y/o S.S. disclosed to a school teacher that her mothers boyfriend has been touching her while her mother was sleeping. This reportedly has occurred on multiple occasions. No further information was available at this time. S.S. is a student at Nelly K. Parker school, who already notified DCP&P as per protocol.    I contacted DCP&P social worker Jennifer Diaz who was assigned to the initial investigation. Ms. Diaz advised me that she was currently enroute to Nelly K. Parker to meet with S.S., and school staff. She advised me that she already contacted BCPO/SVU. I advised her that I will meet her at the school. Upon arrival I met with Ms. Diaz, who advised me that S.S. was set to be picked up from school by another unknown adult possibly the suspect. Due to the circumstances it was determined that S.S. will be transported to BCPO (100 Eisenhower Drive, Paramus NJ) to undergo a forensic interview with SVU. Contact was made to S.S. mother, Ibys Sandoval, who was advised that a police investigation is underway and her presence is required. Ms. Sandoval expressed that she has transportation issues, therefore this agency arranged transport for her.  Det. Reyes responded to pick up Ms. Sandoval at her residence (176 Berdan Place, Hackensack NJ). Ms. Sandoval was transported to Nelly K. Parker to meet up with her daughter, and ultimately transported to BCPO for the interview.   Contact information was limited at the time of this report (See Det. Reyes Supplemental report for further details)",,,,,,,,,,,,,Bay_F,Complete,Det. Frankie Garrett 323,DET,Det. Evelyn Reyes 336,TOT DCP&P,,9,01/23/25 15:00,"On Thursday, 01/23/2025 I was notified by D/Sgt. Dominguez of a possible sexual assault involving a juvenile. I was advised that 10 y/o S.S. disclosed to a school teacher that her mothers boyfriend has been touching her while her mother was sleeping. This reportedly has occurred on multiple occasions. No further information was available at this time. S.S. is a student at Nelly K. Parker school, who already notified DCP&P as per protocol.    I contacted DCP&P social worker Jennifer Diaz who was assigned to the initial investigation. Ms. Diaz advised me that she was currently enroute to Nelly K. Parker to meet with S.S., and school staff. She advised me that she already contacted BCPO/SVU. I advised her that I will meet her at the school. Upon arrival I met with Ms. Diaz, who advised me that S.S. was set to be picked up from school by another unknown adult possibly the suspect. Due to the circumstances it was determined that S.S. will be transported to BCPO (100 Eisenhower Drive, Paramus NJ) to undergo a forensic interview with SVU. Contact was made to S.S. mother, Ibys Sandoval, who was advised that a police investigation is underway and her presence is required. Ms. Sandoval expressed that she has transportation issues, therefore this agency arranged transport for her.  Det. Reyes responded to pick up Ms. Sandoval at her residence (176 Berdan Place, Hackensack NJ). Ms. Sandoval was transported to Nelly K. Parker to meet up with her daughter, and ultimately transported to BCPO for the interview.   Contact information was limited at the time of this report (See Det. Reyes Supplemental report for further details)",176,01/23/25,15:00,,,1/23/2025,15:58:15
25-007074,01/25/25,2025,January,01,04,04,Saturday,025,25,18:00,18:27,Burglary - Auto,Burglary - Auto,Theft,,"Burglary - Auto, Theft","Stanley Pl, 200 Block",206 Stanley Place,"206 Stanley Place, Hackensack, NJ, 07601",H3,8,"Suspect description: Possibly male, approximately 5'7'' in height, with a slim build. On 1/26/25 P.O. Papanikolaou and I responded to 206 Stanley Place on a reported theft from auto. Upon arrival, I spoke with the victim, Phyllis Cunningham. The victim reported on 1/25/25 at approximately 20:52 hours she received a text message from her son. The text was a video of an unknown suspect entering her vehicle, New Jersey Registration R36GBB. The listed vehicle was parked in the driveway at 206 Stanley Place. The victim showed me the video that her son texted her. Upon observing the video I observed on 1/25/25 at 18:27 hours the suspect entered the vehicle from the front driver side door, which was left insecure. Later, the suspect was seen on video to be searching through the vehicle. After the incident the victim responded to check her vehicle. Upon inspecting her vehicle nothing appeared to be stolen and no damage was observed. A New Jersey victim notification form was completed. The victim did not request to have the vehicle processed. At this time the victim reported if the suspect could be identified she would pursue a criminal case.  The victim was advised to save the video surveillance of the incident. Sgt. Competiello was advised.",,,"NJ-R36GBB HONDA, CRV",,R36GBB,HONDA,CRV,NJ,,,,,Levis_R,Complete,P.O. Massimo Gallorini 379,A2,Sgt. Franklin Bay 162,No Investigation,23F = Theft From Motor Vehicle,9,01/25/25 18:27,"Suspect description: Possibly male, approximately 5'7'' in height, with a slim build. On 1/26/25 P.O. Papanikolaou and I responded to 206 Stanley Place on a reported theft from auto. Upon arrival, I spoke with the victim, Phyllis Cunningham. The victim reported on 1/25/25 at approximately 20:52 hours she received a text message from her son. The text was a video of an unknown suspect entering her vehicle, New Jersey Registration R36GBB. The listed vehicle was parked in the driveway at 206 Stanley Place. The victim showed me the video that her son texted her. Upon observing the video I observed on 1/25/25 at 18:27 hours the suspect entered the vehicle from the front driver side door, which was left insecure. Later, the suspect was seen on video to be searching through the vehicle. After the incident the victim responded to check her vehicle. Upon inspecting her vehicle nothing appeared to be stolen and no damage was observed. A New Jersey victim notification form was completed. The victim did not request to have the vehicle processed. At this time the victim reported if the suspect could be identified she would pursue a criminal case.  The victim was advised to save the video surveillance of the incident. Sgt. Competiello was advised.",206,01/25/25,18:27,,,1/26/2025,10:34:25
25-008551,01/31/25,2025,January,01,05,05,Friday,031,31,11:00,11:59,Burglary - Residence,Burglary - Residence,,,Burglary - Residence,"The Esplanade, 200 Block",292 The Esplanade,"292 The Esplanade, Hackensack, NJ, 07601",H5,8,"On January 31, 2025, at approximately 1200 hours the victim responded to Hackensack Police Department Headquarters for a report of a burglary to his residence that occurred in the past. I met with the victim who reported that last Friday, January 24, 2025 at approximately 1200 hours he left his residence with his wife and son for the day. He reported that upon his return to his residence at approximately 1500 hours, he observed the front door (allows entry into the apartment) wide open.  He further reported that he believes he locked the door before he left but did not observe any damage to his door. He reported that he went inside his residence to check if anyone was in his apartment with negative results. The victim reported that the following day, Saturday, January 25, 2025, he looked for his beige folder that contained copies and originals of the following items: passport, social security cards, and licenses of his wife, Arelis Bonilla, and his sons, Eduardo M. Sobrino and Edwin D. Sobrino-Bonilla.       The victim reported that he last saw his beige folder with those documents in his living room approximately one month ago. The victim was advised to contact the social security administration, DMV, and credit companies to advise them of the above. He was also advised on how to obtain new copies of his social security card, license, and passport. The victim was advised to report any fraudulent activity he may see.       A New Jersey Victim Notification Form was completed and a copy was provided to the victim. He was advised to contact Hackensack Police Department should another incident like this arise.       The victim was not offered B.C.I. to respond to the residence due to the apartment being contaminated for approximately a week. Det. Lt. Weber was notified.",,,,,,,,,,,,,Klosk_J,Complete,P.O. Denisse Caero 367,B2,Det. John Tanucilli 335,Active/Administratively Closed,220 = Burglary/Breaking & Entering,9,01/31/25 11:59,"On January 31, 2025, at approximately 1200 hours the victim responded to Hackensack Police Department Headquarters for a report of a burglary to his residence that occurred in the past. I met with the victim who reported that last Friday, January 24, 2025 at approximately 1200 hours he left his residence with his wife and son for the day. He reported that upon his return to his residence at approximately 1500 hours, he observed the front door (allows entry into the apartment) wide open.  He further reported that he believes he locked the door before he left but did not observe any damage to his door. He reported that he went inside his residence to check if anyone was in his apartment with negative results. The victim reported that the following day, Saturday, January 25, 2025, he looked for his beige folder that contained copies and originals of the following items: passport, social security cards, and licenses of his wife, Arelis Bonilla, and his sons, Eduardo M. Sobrino and Edwin D. Sobrino-Bonilla.       The victim reported that he last saw his beige folder with those documents in his living room approximately one month ago. The victim was advised to contact the social security administration, DMV, and credit companies to advise them of the above. He was also advised on how to obtain new copies of his social security card, license, and passport. The victim was advised to report any fraudulent activity he may see.       A New Jersey Victim Notification Form was completed and a copy was provided to the victim. He was advised to contact Hackensack Police Department should another incident like this arise.       The victim was not offered B.C.I. to respond to the residence due to the apartment being contaminated for approximately a week. Det. Lt. Weber was notified.",292,01/31/25,11:59,,,1/31/2025,11:59:50
